,title,pros,cons,rating
1130,"Купил! Остался доволен. В неумелых руках - этот ноут будет вызывать только боль из-за недостатка памяти. Первое, что нужно сделать - выключить апдейт вин10. Второе - оптимизация ОЗУ! После танцев с бубном ноут начал работать так, как нужно. В описании процессора написано 1.1 - 2.4 ГГц, но в БИОСе показывает 800 - 1.1ГГц. Процессора и ОЗУ хватает для офисных задач и просмотра потокового видео. Не более. Ни в какие игры играть на нем не стоит. Ощутимо греется, но не критично. И ещё одно - в цену входит безпроводная мышка Logitech M185. На сайте этого не было указано и я заказал тоже мишь Логитек! Таким не хитрым способом менеджеры магазина продают по две мышки к одному ноуту! Нормальная тема! )))",Корпус. Форм-фактор. FullHD. IPS матрица. Батарея. Win10PRO.,32gb MMC. 3ГБ ОЗУ.,4
1131,"Ноут я приобрел пару месяцев тому. Моделей с 4 гб оперативки уже не было в продаже, пришлось довольствоваться 3 гб, в целом это оказалось не критично. Из достоинств могу отметить то, что в три-четыре раза дешевле аналогичных размеров МакБука, лёгок, тонок и металлический корпус! Батарея держит 7 часов в рабочем режиме и часа 4-5 в режиме просмотра кино. Не недостатки, а скорее вопросы вызывает, почему белорусы (а Престиджио это белорусская контора) решили сделать первый ряд кнопок клавиатуры F1-F12 параллельно кнопками управления яркостью громкостью, отключением тачпада и т.д. При чем сделали эту яркость и громкость основной, а F1-F12 только по нажатию Fn. Если привыкли пользоваться кнопками, то нужно некоторое время перестраиваться. Плюс кнопка Power это крайняя правая верхняя кнопка на клаве. У меня на прошлом ноуте там был Delete, пару раз так ошибался и выключал машину, пришлось кнопку деактивировать в винде, а укладывать в сон по закрытию крышки.  Базовая память всего 32 гб на борту. Можно расширить поставив маленькую ССДшку. После этого заработало отлично и памяти хватает. ССД немного греется во время работы. Смотрел фильм, на коленках 2 часа держать становится жарко. Когда мигрировал Винду 10 на ССД стала работать довольно шустро, но видимо нужно было переустанавливать с нуля (Винда всё-таки) как-то неровно работает WiFi. Подключается только после диагностики неполадок. Но это не к ноуту вопросы а к Винде.  Минусов как таковых нет, есть много особенностей, к которым нужно попривыкнуть. Для путешествий или для быстрой работы во время встреч отличный вариант.","Лёгкий, тонкий, дешевый","Винт нужно докупать, специфические кнопки F1-F12, пришлось чуток повозиться с настройкой Wi-Fi",5
1132,"Чудовий, легкий, компактний. Дуже порадував акумулятор.","Акумулятор, металеий корпус, компакнысть",Немає в комплекті SSD,5
1133,На ньому є підсвітка? Якщо є то як її включити. Наперед дякою,Дуже зручний у використанні,,5
1134,Когда он будет в наличии? :(,"Их много, посмотрев подробную информацию и тестирования данного продукта, я сделал вывод что это идеальный ноутбук для Школьников и Студентов.","Пока незнаю, надо будет купить и протестировать ево когда он будет в наличии",4
1135,"Купил ноут для работы, использую браузер и офисный софт. В браузере открывая 3-5 вкладок ноут начинает очень глючить и работать практически невозможно. Это у всех так или только у меня?",Дизайн. Батарея. Компактность. Качественный экран. Хорошая громкость динамиков. Габариты,"Медленный, тормозит в браузерах.",2
1136,Нет слота для проводного интернета,Много,Нет слота для проводного интернета,3
1137,"Установил ссд на 240гб, поставил на него систему. Ноут летает","Быстрый, хороший екран, подсветка, качественно собран",Нет,5
1138,"Хороший ноут, легкий, тоненький",,,4
1139,Заказ оформили быстро и отправили в тот же день. #моєрозпакування,задачи обработывает быстро,сильно греется,5
1140,"Ноутбук достатньо швидкий і продуктивний. Єдина проблема, з якою я зіткнувся, періодичні ""пропадання"" SSD з системи, тобто, комп""ютер переставав розпізнавати його і відмовлявся завантажуватись. Але, припускаю, що це просто брак, який не є системним, тому це не варто вважати недоліком моделі загалом. Тим більше, гроші за даний товар повернули без жодних заперечень, хоча і зайняло це до двох тижнів часу. Також, якщо це для вас критично, то робота системи охолодження трохи дивна. Кулер не вмикається, доки температура процесора не сягне 95 градусів. Після цього, він вмикається на 1-2 хвилини, доки температура не знижується до 55 градусів. І в такому циклі ноутбук працює постійно.","Швидкий, недорогий",Одразу проявився недолік в роботі SSD,4
1141,Хороший ноут,Тянит норм игри,Нету,5
1142,"Ноутбук в цілому з своїми задачами справляється, що хотілось би виділити людям які хочуть купити в майбутньому даний девайс вдалий процесор (попри меншу кількість ядер як у І5 в нього вища базова частота і в деяких сценаріях використання це буде мати більше сенсу тому шо система охолодження яка складається з однієї теплотрубки яка і на процесор і на відеокарту явно слабувата в даному ноутбуці) варто звернути увагу що мх230 то не ігрове рішення і неварто людям брати його в надії що він буде тягнути хочаб на низькі сучасні ігри суттвевим недоліком є 4 ОЗУ та щей 1 слотом екран також тут не ІПС а звичайна ТН матриця але повторюсь для когось такої машини може бути цілком достатньо)",i3 10110U,4 озу 1 слотом,3
1143,Все круто,,,5
1144,"Идеальный ноутбук для работы в офисе, не сложных задач, просмотров фильмов. Брали для работы в офисе, нареканий нет, в работе показал себя хорошо, рекомендую.","Красивый, приятный на ощупь, для офисных работ.",Не съемный аккумулятор.,5
1145,Ноутбук очень классный. Тянет всё подряд!,Всё,Нету,5
1146,"В использовании 1 месяц. Один раз пропал звук, восстановился после перезагрузки. Малой доволен (покупали на ДР ему). Немного шумные кулера, при запуске CS-GO уже маслают как на взлёте. ГТА 5 тянет легко. Остальные игры пока не качали.","Быстрый, подсветка клавиатуры в тему. Пока всё","Хотелось бы побольше диагональ экрана. Маркой, отпечатки на себе оставляет. Сильно шумят кулера.",4
1147,"Данная модель отлично справляется с новыми играми такие как Red Dead Redemption 2 на высоких с просадками до 40 FPS, а в основном держит 55-60 FPS , AC Odyssey на ульрах в среднем 55 FPS .На поверхности корпуса в раёне клавиатуры не нагревается и не создаёт дискомфорт при игре . К клавиатуре нариканий нет . Звучание динамиков приличное . В режиме работы от батареи про просмотре фильма держит от 2 с половиной до 3 часов . Но играть рекомендую в наушниках, поскольку охлаждение работает шумно","Качество сборки , Звучание",Большой блок питания,5
1148,"А в чому відмінність між таким же ноутбуком, але на 1000 грн дешевше...?",,,5
1149,"Дякую представнику ASUS за відповідь, але я вже вспів купити ноут. Сам ноут цілком влаштовує але трохи розчарував - тим що в нього тип оперативки не відповідає тому що вказано в описі розетки.","Легкий, швидкий, зручний",LPDDR3,4
1150,"В цілому покупкою задоволений. Лінукс з коробки ""ніякий"" - відразу перевстановив Мінт. Тачпад суперовий, яскравий екран. Дуже тихий - спочатку подумав ща кулер не працює але коли добряче нагрузив то почув що вентилятор ввімкнувся але все рівно в порівнянні з моїм старим Леново його практично не чути. Зовнішнє покриття приємне на вигляд але пальці все одно залишають сліди. Ноут цілком оправдовує свою вартість. Недорога машинка на кожен день.","Потужний, дуже тихий",треба переставляти ОС,5
1151,хороший ноутбук за такую цену #мояраспаковка,цена,нет,5
1152,лучший в своем классе!,,,5
1153,"Подскажите пожалуйста, этот ноутбук игру Stalker зов припяти потянет??",,,5
1154,"ноутбук, для презентаций, и не сложного редактирования фото. Эта модель подошла как нельзя кстати. Сенсорный, глянцевый IPS дисплей, показывает очень насыщенно. Операционная система, установлена, запускается за 10 секунд. В графических приложениях, видеокарта mx230, справляется отлично, возможно даже в нетребовательные игры поиграть. Аккумулятора хватает на полный рабочий день. Впервые познал, быструю зарядку, до 80 процентов, заряжается за 1 час, крайне удобная функция.","Сенсорный, глянцевый IPS дисплей","Под не выгодным углом, зеркалит экран",5
1155,"Заказ приняли, выслали оперативно. Всё хорошо, нареканий нет.",Всё нравится.,Пока не обнаружены,5
1156,"ПРИШЕЛ БЫСТРО, УПАКОВКА НЕ НАРУШЕНА. ПОЛЬЗУЮСЬ 3-Ю НЕДЕЛЮ. ДЛЯ РАБОТЫ ХВАТАЕТ",ОПТИМАЛЬНОЕ ЦЕНА-КАЧЕСТВО. ЛЕГКИЙ,ПОКА НЕ УВИДЕЛИ,4
1157,"Печатная машинка, брался под офисные задачи, сёрфинг и удаленку. Ожидать большего глупо. Тем не менее, покритикую, оставлю впечатления. Пластик дешевый, маркий к жиру. На удивление, не скрипит. Дисплей очень, очень бюджетный! После матрицы ips выглядит бедно, блекло, мыльновато. Клавиатура приятная, но отсутствует какая-либо индикация num/caps lock. Вебкамера - привет 15-летней давности, сине-зеленые пиксели :)) Кулер системы охлаждения - это какой-то трэш, начинает беспокойно жужжать, когда держишь ноут на весу, а если его чуть повертеть в руках, будет ощущение, что ""лопасти затирают"". Индикация дисковой активности и питания с правого бока, возле кардридера - очень неинформативно. Длинный, очень длинный старт BIOS. Не нашел как ускорить  Драйвера НУЖНО ставить, не полагайтесь на встроенные от Windows 10! У меня вайфай завелся в режиме AC только после установки драйверов производителя.","SSD 256, память 8 гиг",много,3
1158,Хорошо пока,"За цену норма,красиво,с программой преустановлен","Пока нет,только не поделили ннд на 2части, тяжеловато с десяткой разбираться",5
1159,"Очень хороший ноутбук, за свои деньги прям топ, безосвсяких проблюм тянит все соврименные приложения, я сейчас прохожу батл филд 1 в 60-80 фпс в ейчди розришении, очень много работаю с фотошопом, ниразу не подводил, всем советую!!!",Этот ноут сплошное достоинство,Недостатков нет,5
1160,"4к идёт, танки тоже, за эти деньги шикарно, главное поставить нормальную Винду, а то на некоторых 4к не шло","4к идёт, танки тоже, за эти деньги шикарно",оперативку меняли на более мощную,5
1161,"Делл всегда отличался от других фирм тем что нужно сначала почитать как делать,а потом уже что то предпринимать.При не корректной установки ОС пол ноута не работает,в плане датчиков итд.","Цена,сборка на 4",,4
1162,"Сам по собі ноут не поганий, але намагання змінити встановлену заводом-вирбником ОС перетворюються на танці з бубном, адже, що разу поки встановлюється ОС потрібно знаходити в ВІОS та правити кілька пунктів",Невисока ціна відносно якості,Дуже намучено з завантаженням,4
1163,"Бренд хороший, но на конкретном ноуте практически не возможно сделать upgrade, при данной сборке с таким процессором даже установка 8гб оперативной памяти не поможет. Печально, что предустановлен Linux, на нем работают практически невозможно. Пытался установить 10 винду, но это пытка...","Хороша сборка, известный бренд","Установленный Linux, слабенький процессор",3
1164,получить информацию. смотреть любое видио. отличнс!,хорош,мало памяти,4
1165,"Купил ноутбук для девушки, нужен был портативный с долгоиграющей батареей. Просматривал много других вариантов, но именно эта модель меня привлекла больше всего. Качество сделанный корпус, приятно держать в руках. Экран очень яркий и цветопередача на высоком уровне.Производительности вполне хватает для офисной работы, можно смотреть фильмы в fullHD , youtube ролики в full HD. Батарея держит долго. Система была предустановлена и заняла на встроенном накопителе 13 гб. Звук средний, немного разочаровала веб-камера, качество слабое. Вобщем, рекомендую к покупке!","Легкий, металлический корпус, качественный дисплей",веб-камера,5
1166,"Для офисной работы очень хороший вариант - легкий и шустрый, для моей работы оперативки нормально хватает. Много информации на нем не храню, так как привык все на облаке держать, но при желании можно поставить ssdшку. С алюминиевым корпусом не боюсь таскать его с собой каждый день. Мне нравится.","не тормозит, удобный",пока не вижу,5
1167,"Прекрасна робоча машинка, екран дуже классний як для розмірів","Процессор, вага, дизайн",Не виявили,5
1168,"Покупал не здесь. В целом доволен кроме объёма еMMC. Win10 весит около 25гб, а всего 32гб. Поэтому однозначно нужен ssd. Плюс есть небольшой засвет в левом верхнем углу но не существенный.","Материалы корпуса, сборка, экран.",Критически малый объем жёсткого диска.,4
1169,Чому так мало памяті ????????,тонкий,дуже мало памяті!!!,1
1170,"Планшет в принципі потужний. Екран хороший. Для монтажу топ. Але є одне слабке звено — відео ядро. Воно мобільне. І це велика проблема для ігор. Але оскільки це планшет, то це не страшно. Бо навіть топові айпади слабші. Планшет топ!",Один з найкращих планшетів на ринку.,Вбудована графіка,5
1171,Купил планшет с віндовсом оказывается не самое практичное решение было лаги и медленная робота виндовса добавила страданий.,Мобильность,Виндовс и сложность использования в быту.,4
1172,"После покупки сразу установил десятку, все отлично, все летает","Ssd диск, эргономичный",Несъёмная батарея,5
1173,"Ноутбук на ""вырост"". Производитель оставил место для 2.5 диска и модуля памяти, все это можно легко установить не разбирая ноутбук. За это большой плюс acer. При бездействии кулер процессора останавливается, тут тоже +. Из минусов: матрица конечно же бюджетная, не думаю что за такие деньги будет что-то лучше. Корпус неожиданно маркий. На верхней крышке остаются все отпечатки.  В принципе за свои деньги ноутбук очень неплохой. Клавиатура почти не прогибается при нажатии, ход клавиш приятный. Для бюджетного ноутбука 2019 года очень не плохо. Каких-то явных косяков не вижу. Покупать можно, я думаю не пожалеете.","мощный холодный процессор, удобный апгрейд","маркий корпус, TN матрица, толстые рамки вокруг экрана, нету индикаторов клавиатуры",5
1174,"Ноутбук хороший Монтировать отлично ,тянет хорошие игры как Gta5 Fortnite и т.д. Но есть минус SSd не видет только диск локальный на 118 гигобайт",Хороший процессор Ram 4 gb нормально Full HD,Видеокарта,4
1175,"Качество сборки отвратительное, всё скрипит, интегрированная видеокарта еле ролик на ютюбе тянет",,,3
1176,"Дешевая, скрипучая пластмасса. Только зайти в ютюб или гугл. На большее не способен. Говорю к тому , что цена не соответсвует качеству! Прошел месяц после покупки отвалилась клавиша «стрелка» влево. Сдал в сервис по гарантии. Менеджер не хотя приняла и сразу намекнула , что не поменяют ничего. Так и вышло, сказали что случай не гарантийный, мол сами по клаве кирпичом били. Но на ноуте ни царапины и потертости. С ноутбуком обращался максимально деликатно и бережно. Только пылинки сдувал, грубо говоря... Очень обидно, в официальном сервисе Asus нахамили и отправили, не советую этот ноутбук и вообще связываться с Asus...",,"Всё скрипит, отвратительные материалы и сборка Видео максимум вайс сити тянет, слишком дорого для такого железа",1
1177,Ідеальний варіант для фотошопу,,,5
