,title,pros,cons,rating
536,"Хороший ноут от хорошего бренда для несложных задач (интернет-серфинг, видео, документы). У него интересный цвет - не совсем черный, а скорее графитовый или очень темный серо-грифельный. Фото прилагаю. Меня обрадовал этот цвет, банальный черный ноут не хотелось :)","Тонкий. Легкий (~1800 грамм). Стильный дизайн. Почти не маркая верхняя крышка из текстурированного качественнного пластика, не прогибается. Тонкие рамки (но только две боковые, к сожалению). Клавиатура приятная гна ощупь с плавным и тихим ходом. Чувствительній тачпад. Маленький зарядный блок. Тихий и не греется. Быстрый: Windows 10 загружается за 13-20 секунд; приложения открываются довольно быстро; браузер с 5-10 вкладками не тормозит; ютуб на высоком разрешении также работает нормально.","Экран! Тусклая, блеклая, с низкой контрастностью TN-матрица. Недостаток пикселей в разрешении тоже сказывается, но об этом предупреждали в характеристиках. Звук хотелось бы громче. Маркий тачпад.",4
537,возможна замена процесора?,,,5
538,"Ноутбук не видит SSD диск, позвонил в поддержку, ничего не подсказали - даже не перезвонили. На следущий день, сказали везите ноутбук на обмен. Очень хороший ноутбук, а также впечатления от использования испорчены ситуацией с невозможностью работы с ssd диском.","цена, качество материалов корпуска, внешний вид","не видит ssd диск, который установлен по умолчанию. Очень тонкий пластик корпуса",2
539,Потянет ли GTA5 и FIFA 20?,,,5
540,Вопрос к представителю компании...SSD где там поместился и какой у него интерфейс подключения,еще не приобрел,еще не приобрел,5
541,"Ноутбук для тех, кто много путешествует и кому надо возить ноут с собой. Конечно сначала цепляют размеры этого ноутбука. Он не большой, выполнен в лаконичном дизайне. Клавиатура с белой почти незаметной, если смотреть не под углом, подсветкой клавиатуры. Она круто выручает в темное время суток. По начинке это самый обычный рабочий вариант. Дискретной видеокарты нет, но для работы она и не нужна. Оперативы можно докинуть ещё и превратить и без того хороший ноут в ещё более крутой. Работать на нем мне нравится. У клавиш комфортный ход, матрица не искажает цвета. Покупкой довольна. Рекомендую.","Корпус, мощный проц, возможность расширения памяти, подсветка, матрица",Не обнаружены,5
542,"Хороший ноутбук, приємна біла підсвітка. Поставив швидко вінду, ноут швидко загружається. Саме такий ноутбук повинен бути для офісної роботи, Леново вміє добре робити ноутбуки, рекомендую)",Ціна,,5
543,"Хороший ноутбук, леново умеет удивить.","Дизайн, характеристики",,4
544,,,,5
545,"Столкнулся с проблемой, не работает тачпад после установки всех драйверов. Ранее видел отзыв с такой же проблемой но эго почему-то удалили, и в том отзыве писали что понадобилось некторое время для работы тачпада, заработал сам Жду может случится так же, или же отправлять по гарантии обратно",Не обнаружено,Не работает тачпад после установки,4
546,"С ноутбуком все отлично Единственное что при установке не сразу работал тачпад, не могли долго разобраться в чем была проблема, но потом он чудом заработал Огромный минус розетке, за то что не совсем корректные характеристики указали на сайте. Подсветки клавиатуры в этой модели нет, ребят",,,4
547,Good,,,5
548,"Для домашнего пользования абсолютно нормальный ноутбук, пользуюсь каждый день около двух месяцев.",,,5
549,"Через пару недель во время работы начал периодически включатся вентилятор и очень громно. А так для интернета достаточно, довольно бычтро. Неудобный очень тачпад правая кнопка, невозможно попасть.",Быстрый легкий,Шумный вентилятор,4
550,"Так как отзывов по этому ноуту пока нет, то думаю мой поспособствует тому, что кто то убережет себя от пары седых волос и беготни по сервисам... Купили этот ноут для клиента. Ну, стоит там Linux, в наше время это не проблема... (я так думал по началу) Загрузился с установочной флешки Microsoft Windows 10 1909. И на этапе начала установки обнаружил что тачпад не работает и ни как не включается (ни с Fn+F7, ни просто F7) и в биосе про него ни чего нет.. Ну и ладно, подумал я, платформа свежая, видать в Microsoft еще чего то не допилили.. Подключил внешний манипулятор и продолжил установку. Винда стала, все драйвера сама подгрузила, в диспетчере устройств не осталось ни одного неустановленного или неизвестного устройства! А тачпад так и не заработал, и какие бы комбинации кнопок я не искал ни чего не помогало, даже курсор исчезал при отключении внешней мыши... Ну бракованный подумал я, бывает к сожалению иногда.. Решили отправлять этот по гарантии, и заказали точно такой же. Пришел второй, ""брат близнец"" :) с той же самой проблемой!! Я уже грешным делом решил что - Ну ничего себе мы фартовые! Это же как должны были стать звезды?! Что только мы во всем мире, попали сразу на два подряд бракованных ноута, да еще и с одной и той же проблемой!!! В общем закралось у меня подозрение, что все таки что то тут не то! И таки да! Кто бы мог подумать, что оказывается в системе есть устройство которое вообще ни как не проявляет себя и ни где не фигурирует, пока не установишь драйвер (драйвера от тачпадов тоже не катили.. от слова никак) который ну совсем ни как не похож на драйвер который отвечает за манипулятор... В общем качаете с сайта производителя - Serial IO Driver, который добавит вам системное устройство, после добавления которого появляется тачпад. И даже комбинации кнопок заработают на его включение-выключение..","Отличный, шустренький и стильный ноут",Свежий! Очень :),5
551,"Это крутой имиджевый ноутбук. Здесь важны не только характеристики, но и дизайн. Размеры компактные, вес легкий, все для того, чтобы вы могли работать с него с любой точки мира. Лаконичный корпус, выполненный из металла и пластика, подсветка клавиатуры, ips матрица. Отдельно стоит сказать про звук. Он здесь на твёрдую 5, как для ноутбука. Громкий и глубокий. А если этой громкости не хватает, всегда можно подключить колонку. Процессор хорош, работаю с комфортом. В плане характеристик придраться не к чему. Хороший ноутбук для работы.","Имиджевый дизайн, стабильность работы",Ноутбук очень нравится,5
552,"Хотелось бы больше диагональ, но дисплей хороший, красивый. Сам ноутбук производительный, но за такие деньги хотелось бы видео по мощнее",,Графика,4
553,"Хороший ноутбук,работает быстро,клавиатура удобная очень,батарея при просмотре фильма садится 20% за один час","Красивый,мощный,громкий","Угол обзора маленький,чуть влево вправо и экран темнеет",4
554,"Ноутбук отличный, быстрый, компактный, легкий, экран очень качественный. Рамки экрана - вышел всяких похвал. Наличие двух накопителей облегчает жизнь при переустановке ОС и в целом объема памяти более чем достаточно. Даже поиграть иногда на нём можно в популярные игры) Использую для работы, много открытых программ, вкладок в браузере, музыка = 4 часа работы от батареи. Рекомендую!",Перечислил в описании.,"Всё же софт тач маркий, крышка тоже, но это нормальная физика)",5
555,"Купил ноутбук сугубо для работы вне офиса, ориентировался на емкую батарею (у меня максимум что держал 8 часов при работе с документами) и достаточную мощность чтоб не потерял актуальность пару лет и хороший звук так как иногда нужно. Данный вариант выбрал в магазине посмотрел крепления и корпус что меня удовлетворило полностью, так как прошлый хп бул слишком хлипким и быстро раскрошился(. Так же понравилось что есть наличие двух систем хранения (жесткий диск и ссд накопитель), это очень облегчает работу. В старой модели хп не было подсветки клавиатуры, в этой есть что очень облегчает набор. В целом за пол года работы полностью доволен покупкой, Легкий удобный долго держит заряд полностью справляется с моей работой. К покупке рекомендую)","Производительный, быстро заряжается, не маркий, долго держит заряд при работе",Пока не нашел,5
556,,"быстрый, тонкий, удобный, производительный","не помешала бы подсветка клавиш, но не критично",5
557,"Брали для сына, он занимается программированием, Все понравилось",Отличный ноут,Не нашел,5
558,"Отличный ноут, быстрый, тянет приличное количество программ и игр, заряд держит хорошо, тонкий и аккуратный","Все подходит, отличный вариант за эти деньги",Не выявил,5
559,"Брала ноутбук для личного пользования. В целом, всё нравится: производительный, тонкий, весит довольно мало для такой укомплектовки. При использования браузера аккумулятор вытягивает на 2 часа при уровне яркости около 40-50%. Очень слабовато, хоть и заряжается быстро.",,,4
560,"Хороший ноутбук, рабочая лошадка. Достаточно шустрый.","Дизайн, цена",За 2 недели для себя не обнаружила,5
561,"Перейшли на дистанційну форму роботи. Замовила оптимальний офісний варіант у вигляді цього ноутбуку. Чекала замовлення 6 днів. Отримала. Ноутбук вимикається одразу після включення. Тепер повертай за свої гроші і чекай діагностики до 13 днів. Прошу не повертати мені даний апарат, який вже одразу не працював",-,-,1
562,"На свої гроші ноутбук хороший. Два тижні з ним працюю, недоліків так і не виявив. Стосовно апгрейду, можна доставити ssd, можна міняти оперативну память. Екран IPS, під кутами не вигорає, колір не змінюєтся а 250Nit вистачає для комфортного перегляду фільмів. Зву Dolby з ефектом присутності, обємний рівно наскільки він може бути враховуючи габарити ноутбука і динаміків вцілому.","Метал, можливість апгрейду, хороша матриця, звук Dolby",Не виявив,5
563,"Хороший ноутбук для офісної роботи саме для цього його купляв, справляється на ура з своїми обов’язками. Потужна батарея, в режимі роботи по 9 годин.",Ціна,,5
564,"Очень шустрый, симпатичный, тонкий, просто супер, цена - качество. Очень довольна.",,,5
565,Заявленные 512 на месте.,,,5
566,"Пользуюсь уже месяц, очень доволен. Компактный, тихий, холодный, держит батарею долго. Корпус тонкий, верхняя крышка металлическая, на рабочей панели приятное для рук напылением, безрамочный корпус делает гораздо меньше чем обычные старые 15.6"", порадовала шторка для камеры. Хоть и нету дискретной графики, интегрирована графика от Intel справляется даже с онлайн играми, её мне вполне достаточно. Быстрая зарядка за час заряжает ноутбук. За счёт SSD и мощьного процессора, работать в Word Excel, сёрфить в интернете сплошное удовольствие. Экран яркий и красочный с хорошим углом обзора. Рекомендую эту модель всем кому нужен ноутбук для комфортной работы.","Цена, корпус, экран, батарея",Не обнаружил,5
567,"Ноут приятно держать в руках, Корпус аккуратный, достаточно жесткий, петли надежные( открываются на 180 град). Экран с отличной цветопередачей, и углами обзора.Клавиатура полноразмерная с хорошим откликом. Звук разборчив.Производительностью доволен, никаких подтормаживаний (тянет много программ одновременно легко),винчестер ёмкий и быстрый.Батарея держит целый день, есть быстрая зарядка. Покупкой доволен, рекомендую.","дизайн, производительность",нет,5
568,Адекватний ноутбук за свою ціну,Ціна.,Немає,5
569,"Доволен ноутбуком, считаю, что цена и качество соответствует","Хороший, шустрый, компактный",Не обнаружил,5
570,Для работы для дома ноут суперовый. Цена-качество.,Для работы самое оно.,Нет,5
571,"Ноут на твердую 4. Понравился внешний, толщина, дизайн. Смотрится современно. Наличие подсветки клавиатуры тоже порадовало. Верхняя крышка метал. Панель вокруг клавы мне показалось тоже, либо пластик с металическим напылением. Но обнаружил несколько минусов. Первый - матрица хоть и IPS, но охват цветов у нее не далеко ушел от TN/SVA. На глаз я бы сказал гдето 50-60% NTSC. Максимальная яркость также не радует. Всего 180 nit. В общем, за эту цену это лучше чем TN/SVA, но матрицы явно бюджетные. Думал хваленный Райзен не шумит и не греется, тем более что 3 серия это начальный уроень, однако во время установки и настройки Виндоус температура была в районе 55 градусов, ноут снизу был ощутимо теплый и батарея расходовалась довольно таки быстро как для такой небольшой нагрузки и максимальной яркости. Нижняя крышка также немного продавливается. В остальном отличная рабочая машинка за эти деньги. Учтите, что видеоядро процессора сразу забирает 2 об оперативки и пользователю остается всего 6 гб. Мне он показался тяжеловатым. Ощущается как ~2 кг, а не 1.8.","Внешний вид, дизайн, подсветка клавы, материалы, ничего не скрипит. Выглядит дороже своей стоимости.","Матрица не очень яркая и не очень насыщенная, ощутимо греется без большой нагрузки, охлаждение немного посвистывает",4
572,"Взяла ноутбук для работы. На ссд поставили виндовс. По итогу памяти на ноутбуке много, вполне достаточно для программ и файлов. Винда загружается за 4-5 секунд, ссд хорош! Производительность у ноута не плохая - не шумит, не перегревается. Экран здесь отличный. Ips матрица качественная, не дешевая. Особо порадовал звук. Как для ноутбука он громкий и при этом чистый. Пока что я всем довольна, если появятся нарекания - дополню отзыв.","Экран и звук, система охлаждение, ссд и жесткий диск (ссд хорошего качества)","Если появятся, обязательно напишу",5
573,"Купив 15.02.2020. Ноутбук легкий та компактний. Встановив Win10_x64 та драйвери, які були на HDD. Все працюе крім NumberPad.Підкажіть як вирішити проблему. Дякую.",Мала вага,NumberPad,5
574,Кто-то брал как ноут?,,,5
575,Купив дружині. Враження: просто бімба.,"Компактний, легкий, стильний, абсолютно тихий, гарна IPS матриця, FullHD, швидкий SSD, енергоефективний","4 ГБ розпаяно, неможливо зробити апгрейд RAM, клавіатура на 4-",5
576,В восторге от этого ноутбука. Для работы в интернете и не сложных задач идеально. Батарея выдерживает 8 часовой рабочий день без дозарядки. И за месяц использования ни разу не нагрелся у меня. Этот компьютер стоит своих денег однозначно!,"Очень легкий, бесшумный, совсем не греется, нереально красивый цвет.",Не работает сканер отпечатка пальца,5
577,На него можно установить любую ОС? установленный Linux не сильно отличается от Ubuntu?,,,5
578,,,,4
579,"Скажите, пожалуйста, он 32 битный или 64 ?",,,4
580,"Ноутбук в целом не плохой, но сильно греется и очень слабый",,,3
581,"Майже рік користуюсь цим ноутбуком, задоволена на всі 100%.","Батарея довго тримається та швидко заряджається, компактний, не гріється, тихо працює - рекомендую :)",,5
582,"Отличный ноут! я и девушка для которой он покупался очень довольны им. Со звуком всё отлично, ничего не хрипит и тд, динамики громкие для такой малютки. Очень стильный дизайн,тонкий и легкий металлический корпус,маленькие рамки что делают его компактней, сочный IPS экран, FHD, очень даже приятная вэбка, клавиатура с подсветкой, отлично держит батарея, есть отпечаток пальца для входа в систему, есть HDMI и быстрый беспроводной стандарт вай-фай ""ac""",,не обнаружил,5
583,У моего друга такой же говорит что хороший и для игр и для других вещей хочу и себе купить такой,,,4
