,title,pros,cons,rating
0,"Доброго времени суток. Получил ноутбук через 3 дня. Вопрос магазину ""РОЗЕТКА"", заказ доставлялся через ""JUSTIN"". Пришло все в заводской упаковке с пломбой, которую не разрешили открыть на пункте выдачи, мотивируя это тем, что они получат по одному месту. КАК МНЕ ПРОВЕРИТЬ ПОСЫЛКУ НА ПРЕДМЕТ ДЕФЕКТА И КОМПЛЕКТАЦИИ? Решите этот вопрос и дайте разрешение вскрывать несмотря на заводские пломбы. По поводу самого компьютера. Это мое первое впечатление и опыт только один день. Все упаковано хорошо. Выглядит он в живую лучше чем на сайте. Windows стал хорошо. Драйвера установил с сайта. Советую не форматировать раздел диска на котором уже были драйвера. Просто разбейте диск на котором нет разметки. Ничего страшного если удалите как я)) Все решаемо и тогда милости просим на сайт тех. поддержки. С тачпадом, конечно мучение. Если не станет с сайта ACER тогда перейдите по ссылке https://community.acer.com/en/discussion/584678/touchpad-drivers-acer-aspire-a515-54g там скачаете архив, разархивируйте и установите. Пластик ""добротный"", не метал конечно, прогибы есть если сильно давить специально, но при нормальной эксплуатации вы этого не увидите. Отпечатков не остаётся на корпусе. На крышке нет зацепа, то есть нужно поддевать крышку пальцем, что бы открыть её, не продумано. Экран сочный и четкий, рамки по боках минимальны и смотрятся очень хорошо. По железу нареканий нет, брал для работы, учёбы по программированию и возможно поиграю в пару игр. Все очень шустро, SSD c процессором очень решает. Те кто хотят его, как игровое решение, мое мнение поищите другой вариант с более мощной видеокартой. Портов хватает. Звук из динамиков нормальный и чистый (бывают конечно и громче). Ход клавиш мягкий и тихий но подсветка выключается через 15 - 20 сек., что не очень удобно. По времени работы ничего не скажу так как еще не пробовал. Хорошая рабочая станция для средних и выше - средних задач. Довольный как слон. Рекомендую. Цена - качество, больше нечего добавить.","Хорошая сборка, крышка из метала, шустрый SSD диск, тонкие рамки по боках дисплея, хорошая IPS матрица, мягкий ход клавиш","Быстро выключается подсветка клавиатуры, нет зацепа на крышке, а дальше покажет время.",5
1,SSD NVMe Kingston RBUSNS8 512GB,,,5
2,Какого цвета подсветка клавиатуры?,,,5
3,  ,,,5
4,"НО!!!! Не смог купить в кредит! Так как, выбор падает только на один обслуживающий банк, которой с учётом того что я выбрал этот ноутбук, с доставкой домой, предлагает мне в условиях карантина когда не ходит общественный транспорт брать такси е ехать в один из отделений банка заражая других людей опасным вирусом или быть подвергнутым таковому, только чтобы подписать бумаги или ждать когда закончиться карантин. Это всё что может предложить мне кредитная программа компании розетка!? Конечно я не доволен! В даной ситуации, никто даже шагу не смог сделать навстречу клиенту...",Крутой,нету,5
5,"Можливо комусь трішки полегшить установку системи мій відгук. Установка, з самого початку(якщо нічого ще не видаляли): Чорний екран це UEFI загружчик (потрібен для коректного встановлення Windows.): вставте флешку з Windows, на чорному екрані (в терміналі UEFI) напишіть exit, далі натисніть enter. Вас перекине на екран вибору звідки завантажувати Windows вибираєте свою флешку. При виборі кастомної установки вибираєте пустий розділ для установки, на першому розділі диску знаходиться сам UEFI загружчик, в розділі WINDRIVER знаходяться драйвера на ноутбук -- не видаляйте їх. Для мене вони виявилися найбільш коректними ніж при автоматичному встановленні за допомогою Windows update. При установці Windows не підключала інтернет, щоб не завантажувалися не коректні драйвера(можливо виробник пофіксить, але наразі так). На WINDRIVER знаходиться образ диску з драйверами тому клікаєте на нього Windows зайде >> в папці Autoran >> autoranX >> autoranX (application) перший драйвер встановлюйте чіпсет далі по черзі всі, коли просить перезавантажити - робіть.","Швидкий, екран гарної якості, батарея тримає довго(офісна робота), легкий","Треба розбиратися з установкою системи, тричі ставила Windows. Виробник радить установку драйверів автоматично з їхнього сайту та працює не коректно(у моєму випадку))",4
6,"Забрали ноут вчера. Поставили видндоус. Все вроде как работает но сегодня возникла уже первая проблема. И ещё одна проблема была видна вчера и не знаю как ее решить. Указано что процессор работает в частоте от 1.6 до 4.2 но система показывает что проц поддерживает частоту от 1.6 до 2.11. Вопрос к представителю Acer, с чем это связано и как это решить?",,,3
7,"Доброго дня. Питання до представника. Коли запускаю якусь гру - ноутбук веде себе неадекватно. Лаги і тремтіння звуку і картинки. Добре видно на WOT. Думав що проблема у відеокарті. Встановив найновіші драйвера і все запрацювало, але на наступний день те ж саме. Скажіть, це проблема з відеокартою, чи це можна якось вирішити?",Ціна - залізо,Танці з бубном.,3
8,"Приобрёл сей девайс, радость была до первого запуска. Создав загрузочную флешку (руфус 3.9) с вин10 столкнулся с первой проблемой, Boot security. Погуглив с пол часа и посмотрев видео в тубе, нашел решение, загрузился с флешки и... Не видит он SSD от слова ВООБЩЕ!!! Пишет что ""Нам не удалось найти драйверы. Чтобы получить драйвер запоминающего устройства, нажмите кнопку 'загрузить драйвер'."" В начале установки где идёт выбор языка комбинацией клавиш Shift+F10 и прописью в командной строке Diskpart и list disk не отображает накопитель! Только флешку. Ну дамаю, может это винда... А нет, 3 других сборки показали ту же проблему! Завтра везу в сервис...",тонет быстро!,,1
9,"Хто може підказати в чому може бути причина такого, як у відео?",Ціна - залізо,Глюки відеокарти,1
10,"Пользуемся этим ноутом 4 месяца, Всё просто класс. Производительность бомба, перегрев и шум решается легко. Обновил биос, отключил Boost, и сделал андэрволтинг видео карты. Тихий и быстрый. Покупкой доволен. Рекомендую.",,,5
11,"Брали для роботи з офісними документами, автокадом, фотошоп. Основний акцент під автокад. Що можу сказати - завантажує все швидко, вентилятора практично не чутно. Про звук в мінусах, кришку теж. Дисплей мені подобається. Я скіільки перепробував сучасних ноутів з Full HD та матовим покриттям - купа тусклих екранів, не дуже добре читабельних (особливо це стосується Леново). Клавіатура крута, тачпад теж, корпус схожий на метал (передня частина). Замацується швидко, але видаляються плями теж легко. ССД тут від Самсунг, тому літає. 10-ка ліцензійна стала хв за 7. В ігри не граю, сказати нічого. Але думаю, що ССД на 256 і + на 1Тб шдд і армія шанувальників була б в рази більша.",за таку ціну крутий.,"якщо порівнювати з моїм стареньким Асером, то вага відчутніша на спині. Звук, як на мене, занадто об""ємний. Трохи бовтається кришка з дисплеєм. Якось не так чітко і не рухомо вона сидить, як на Асерах.",5
12,"Отличный ноутбук, летает","Шустрый, яркий, подсветка, начинка, клавиатура",Не обнаружены,5
13,Ноут за эти деньги хорош! WOT на ультрах. Для работы очень быстрый. Програмы открываются секунда. Екран хорош. Шумит средние. Аж удивлен был. В играх. Работать то тихий. Клавиатура мягкая и четкая.,"Сборка, екран, мощность.",На 1000грн. мог быть дешевле.,5
14,ракета! працювати і грати ігри одне задоволення,"Швидкість, IPS матриця, металевий корпус",шумить не критично,5
15,"нормальный ноут, работает шустро и быстро, особо написать ничего не могу, так как в игры не играю, использую его для работы. Где-то читал что сильно шумит охлаждение, у моего вентиляторы вообще не слышно.",,,5
16,Очень достойный ноут!,,,5
17,Відмінний ноутбук!,,,5
18,"Кто то сталкивался с проблемой установки Винды? Не видит загрузочную флешку хоть что делай... Убрал Security boot, но не могу поставить маркер на флешку в legacy boot order. На ютуб куча видео, все перепробовал, но проблема не решена. Флешка рабочая, переписывал и в mbr и в uefi - не помогает. Судя по тому, что я первый с таким отзывом, делаю что то не так. Нид хелп... Спасибо!",Пока не тестил,Пока не тестил,5
19,Здравствуйте. Может кто-то знает где можно купить шлейф для hdd?,Все супер,Нету шлейфа для hdd,5
20,відмінний ноутбук за хорошою ціною.,,,5
21,"Чудовий девайс за свої кошти. Відео дійсно 1050ті, хоча я чекав підвоху від розетки. Вживу гарніший ніж на фото, працює швидко. Чудовий варіант для тих, хто розуміється.","1050ті за смішні кошти 8300Н з 8 мб кеша 3 рівня Приємна зелена підсвітка Металевий(сплав) корпусу, гарна система охолодження","Озу встановлена 2х4гб Не регулюється яскравість підсвітки клавіш, як в тому ж легіоні.",5
22,"Купував на сайті rozetka, доставка бескоштовна та швидка. Дякую магазин за гарне обслуговування. Користуюся ноутбуком місяць, мені він подобається. При нагрузці чути роботу вентиляторів, але це не критично. Використовую операційну систему linux Fedora 31. Пробував ставити Debian так як я працював раніше на ньому, він почав глючити та злітати, не знаю навіть чому. Також ставив Ubuntu, вона теж якось не повністю коректно працювала. Попала на очі Fedora 31, вирішив спробувати встановити. Все запрацювало так як треба. Якщо хтось бажає встановити Linux, моя вам порада, ставте Fedora не пожалкуєте.",Мені подобається все.,Поки що не виявив.,5
23,"Купил ноутбук перед н.г. что могу сказать , отлично работает , игры 2018 года по-моему не очень уважает , на примере фар край 5 и ромб райдер идут практически на ультрах. Но, всегда есть это но . Через 20 минут (с подставкой вентилятором ) нагревается оч сильно . Скачал программу замерял температуру 95-98 градусов проц !!!!!!! Да вы чего ребята ??? Вопрос к представителям компании .зачем впихивать такое железо ,если система охлаждения не справляется даже в половину ?????!!!!!!!! Хотел уже вернуть.. но что он мне приглянулся... Решении проблемы . Через программу Trottlesstop делаем андервольтинг (да слово пугающее но на практике все просто ,каждый разберётся ) на -0.180 на процессор и -0.120 на кеш .и устанавливаем предел турбобуста на 3.5 ГГц Тогда температура падает до 84-92 градуса . Но мне показалось что и этого многовато . В этой же проге убираем турбо буст . Ну вот теперь нормально 60-75 в играх на тех же требованиях , при таком же ФПС 30-43 ,разница не вижу .  Ну какой вывод может быть . Не понимаю зачем человек купивший ноутбук (игровой) танцевать с бубном , шаманить в программах чтобы все работало не перегреваясь? При всем при этом процессор заявлен 4ггц а при отключении турбобуста получаем 2.2... В играх разница не заметил вообще ... Что странно . Ну вот и думацте . Играть нечего не делая и нагревать проц и карту на мах. И сколько прослужит аппарат? Год полтора ?если повезёт . Сделать андервольтинг и играть более менее температурах ? Но вроде тоже высокие ... Ещё и выключить турбобуст ,вроде разница если и ощутима то чуть чуть , но как-то обидно ,ты ведь купил проц 4 ГГц а не 2.2 ...",Довольно шустрый. Хорошее железо за эти деньги .интересный дизайн,Греется,4
24,"Ноутбук хороший. А вот обслуживание Розетки плохое. С ноутбуком не выслали ни гарантию, ни счет на товар. После длительных переговоров с call центром удалось все таки получить гарантию. Копию счета сбросили по электронной почте, а вот оригинал сказали что выслали почтой, но спустя месяц ничего не пришло. Смущает такой сервис, чем дороже товар, тем меньше ответственности.",,,4
25,а теперь о плохом: память 2Х4 Гига (оба слота заняты и теперь придется искать куда деть эти малоемкие планки ОЗУ) - HDD SATA - нет шлейфа подключения (найти - невозможно) - так что хочет расширить добавлением диска - обломс. знал бы заранее - не покупал бы :( - очень- проблемно расширить железо,"производительность, клавиатура, хорошая матрица экрана",надурилово,4
26,"Купил я значит этот ноутбук для рендеринга в мовави, где он практически быстро справляется со своей задачей, поставил ведьмак 3 на средних - 60фпс, но... температура видео и проца ~90*, ноут ну очень уж горячий, на ногах не полежит) подставка нада для игрух. Есть 2 засвета в левом углу, но они видны оолько когда черное изображение, а так ноут сам по себе шустрый, я доволен","Ссд, не слабый проц и дискретная карта, ипс экран, батарея держит 3 часа если не в игры играть, металический корпус(крышка матрицы пластиковая)","Очень уж греется в играх, нужна подставка, зарядка так же гарячая",4
27,"1. Функциональные кнопки (F1-F12) инвертированы относительно клавиши Fn (лечится через биос). 2. Все еще BIOS, а не UEFI. 3. Очень маркая поверхность (оставляет отпечатки). 4. Кнопка включения абсолютно неудобна. 5. Чтобы вставить флешку в юсб-порт, нужно приложить усилия. 6. Не проходит тест ""открыть одной рукой"".",Все характеристики соответствуют заявленным в описании,Несущественные неприятные мелочи :(,4
28,"І так, ноутбук непоганий, але як на мене міг би бути більш якісний. Клавіатура така ж погана як на моєму g5 за 6500. Яка через пару місяців почала вимахуватись і заліпати. Екран хороший, корпус маркий. Кришка екрану в мене відкривається з потріскуванням (думаю десь щось не в зазорах), сама матриця встановлена не рівно. Також прийшов вже з проблемою батарейки. Пише що емкість 97%. У мене так було на ноутбуку якому 2 роки і сотня підзарядок. Думаю ця проблема мені ще вилізе. Але здавати в СЦ нема коли, потрібен ноутбук для роботи кожен день. Тачпад непоганий, звук не сказав би що крутий, але теж непоганий. Встановлений лінукс (арч) і віндовс 10, всі драйвера без проблем. Гріється, дуже, але тільки в іграх. Шумить, порівняно нормально, але тільки під нагрузкою. У мене також трохи підвиває один вентилятор.","Швидкий, гта 5 на максималках тягне",Про недоліки у коментарі,4
29,"У вас у всех в ксго фпс скачет 180-80 ?   Неприятно играть, картинка разрывается. В других играх всё ок, кто-то сталкивался с такой проблемой ? Как решить?",,,4
30,"Лучший ноут за эту цену, искал во всех крупнейших магазинах","Цвет, подсветка, IPS, 1050 Ti, производительность",Шумит при нагрузке. Не положили гарантию,4
31,"Начал шуметь на низких оборотах через 2 недели((( подскажите пожалуйста не работает касание двух пальцев слайды в лево право(перед назад) дрова, все обновлял разные пробовал, но в настройках elan нету такой функции(((","Цена, качество, дизайн, мощность. Очень приятный и красивый.","Шумит, не работают слайды (вперёд назад) на точ паде. Очень греется ((",4
32,Підскажіть будь ласка як на цій моделі підкл ючити wifi? Через мережовий провід? Чи десь в налаштуваннях? Бо кнопки я так зрозумів немає там(.,Дизайн.,Для мене виникли проблеми з підключенням wifi(,4
33,"Хто купує одразу беріть охолоджуючу підставку,він гріється як духовка,хоча працює 3й місяць ідеально,але при такиих темперетурах скільки пропрацює це питання.","Малі розміри за рахунок малої рамки,відеокарта, хоч і не останньої моделі,але для нас бідних людей зійде як бюджетний геймерський.Дизайн.","Нагрів.Одного кулера на таку ""мощу"" не вистачає.",4
