,title,pros,cons,rating
1636,"Искал ноутбук с мощным процессором, остановился на этой модели, очень доволен устройством все игры запускает на высоких настройках, ничего не зависает, работать на нем одно удовольствие. Очень классное охлаждения, 4 тепловых трубки, уникальный воздухоотвод, уникальный корпус не похож на другие игровые ноуты. Мне все нравится, спасибо",Охлаждения,Мало ОЗУ,5
1637,"Ноутбук хороший. Данная комбинация процессора и дискретной видеокартой тянет самые требовательные игры. В перспективе планирую добавить 2-ю планку ОЗУ 8 Gb для активации Dual Chanel. И естественно SSD в свободный слот формата 2,5' т. к. 256 Gb в нынешних реалиях мало. Единственный минус за 3 недели эксплуатации: средняя громкость динамиков, но сам звук качественный. В наушниках звук отличный.","Процессор, дискретная видеокарта GTX 1660Ti, быстрый NVMe SSD.",Не громкие динамики,5
1638,"Мені сподобався. І доставка безкоштовна. Великий екран та швидко реагує(не так як мій попередній ноут),не поганий звук.",Написала,Поки не виявила.,5
1639,"Все хорошо, только нет вебкамеры.",,,5
1640,"Подозрительный нагрев под нагрузками, процессор растапливает до 80-90 градусов, ещё тестируем и смотрим, но на процесс не влияет, всё идеально!","Дизайн, мощность, сборка, блок питания, клавиатура, экран",нагрев,5
1641,Вопрос к представителю АСУС. Есть ли в экране функция NVIDIA G SYNC? Заранее спасибо за ответ.,,,5
1642,"Прошу допомоги ASUS.  Сьогодні купив цей ноутбук, але поки тривають ""танці з бубном"", бо драйвери, які качаю з офіційного сайту для цієї моделі чомусь не встановлюються. Ні на відеокарту, ні на звукову, ні купу інших не вдалося поставити. Можливо, хтось підкаже де є актуальні драйвери робочі під цю модель?  Поки сильно гудить та гріється на простих задачах - скачування/копіювання. Але, може, це через те, що драйвери не стали.",Швидкий,Гріється,5
1643,"Класний ноутбук, у топовій комплектації, його вистачить мінімум на 5 років для ігор на ультра-максимальних налаштуваннях.","Діагональ дисплею, і частота оновлення у 144 Гц,підсвітка клавіатури","Дорогуватий,великий адаптер живлення",5
1644,"Покупал ноутбук больше полу года назад. Ноутбуком полностью доволен. Недавно добавил к нему hdd на 1 TB. В ноутбуке было предусмотрено каретка и все необходимое для установки диска. Перед этим звонил в поддержку Леново, где мне сообщили что при самостоятельном добавлении диска гарантия не слетает.","Шустрый, компактный, относительно легкий.",За свои деньги не вижу в нем недостатков.,5
1645,,"Тонкий, компактний, чудовий екран, безшумний, довго тримає заряд",Немає,5
1646,"Отличный ноутбук за свои деньги. Скорость загрузки системы не может не радовать. 2 режима подсветки клавиатуры, сама клавиатура очень отзывчивая и прямо вызывает желание печатать) Встроенные динамики не пищат и нормально передают басы. Тонкие рамки вокруг экрана добавляют стильности и сам экран не кажется маленьким на свои 14''. Для ежедневных задач отлично подходит, не тупит. За 3 месяца использования недостатков пока не нашла.","Шустренький, клавиатура, экран, легкий, цвет",Пока не обнаружила,5
1647,"Нормальний ноут за свою ціну, нічого вау, але свої гроші добре вдпрацьовує.","Гарний, легкий, достатньо потужний, екран нормальної якості, автономність 6 год в режимі написання коду та браузингу, звук не для меломанів, але може бути","Залишаються відбитки на кришці; пробіл н зручний для мене, по формі клавіатури я нажимаю на його лівий край(там де іконка підсвітки клавіатури) , але він не реагує",4
1648,,,,4
1649,"Переоцінена машина, але крута.",,Ціна,5
1650,Есть ли отсек под обычный HDD?,,,4
1651,А 2D ігру хоч потяне,,,5
1652,"Классный стиль, выглядит прикольно, норм характеристики",Стиль,Нет,4
1653,Вопрос к представителю компании: есть ли ограничение на устанавливаемый объем ОЗУ? Спасибо!,,,5
1654,"Интересный дизайн, на любителя, но нравится за мощность",мощность,Нет,5
1655,"Великий,хороший ноут. Швидкий в роботі.Супер на вигляд. Мені в ігри в ньому не грати, так що мене все влаштовує.",Є,Клавіатура без підсвітки,5
1656,Смотрю на цену аж плакать хочется для ЧЕЛОВЕКА С РЕДНЕМИ ДАХОДАМИ ОЧЕНЬ ОЧЕНЬ ДОРОГО!,"32Ram,RTX2070, 240grz",ЦЕНА,5
1657,"Сходил для начала в магазины пощупать вживую качество ворпусов, клавиатур и тп, выделил для себя Lenovo ideapad s340. Дальше было много гугла и аналитики цен, конкурентов и конфигов. По конфигу для офисной машинки победил ryzen 5 3500 +vega8 + IPS экран, цена ниже Intel i5 этой ценовой категории при более мощном видео. Дальше уже был готов заказывать Lenovo ideapad s340 в этом конфиге, но заметил серию ThinkPad при цене +2к грн за аналогичный конфиг. Снова много гугла и в итоге заказал оба на точку самовывоза. Решил посмотреть \ потрогать живьем ( нигде в магазинах эдектроники его на витрине найти не удалось. Как открыли ThinkPad решил брать именно его. Приятный IPS экран, но не более того (вспоминаем цену), железо более чем актуальное, возможность доставить до 32 гиг памяти (буду добавлять+8 гб планку). Прятная клавиатура, кроме одного но. Хорошая зарядка с type c и многое другое. Пока только положительные эмоции, не жалею про доплату.",Описал в коменте.,"У ThinkPad на клавиатуре поменяли местами fn и Ctrl и єто сейчас жутко бесит, думаю можно будет переназначить обратно)",5
1658,"Долго выбирал что взять на основании цены (до 15000 грн). Основными критериями были: - IPS матрица с матовым/ярким дисплеем (здесь стоит NV156FHM-N49, нашел разбор такой же модели но с ryzen 7 3700U и Vega 10 так вот там указанно о 290-300 нит. За такие деньги приличный вариант); - 4 ядра физических(у нас на борту 4ядра/8потоков); - возможность добавить озу/ссд/хдд(здесь все это можно сделать открутив несколько болтов). Заказал в розетке 3 ноута, а именно 495/595 синкпады и прошку от HP ProBook 455R G6 (7QL74ES) Silver). Хюлед пакерд отверг только из-за клавиатуры, там она убогая, но в остальном ноут оч приятный на вид. Так вот разница с 495 кроме экрана и матрицы заключается в NumPad и цене (странно но 595 стоил дешевле 495го). А еще в 495 некрасивая рамка под монитором, она огромная! В 595 выглядит элегантней. Звук отличный как для ноута! Батарея хорошая. Зарядка на 65 ват - что так же не плохо! Система охлаждения тихая, стрестесты не запускал но тишина и еле теплое дно гарантировано! Мое мнение таково - это лучший вариант в этой ценовой категории с таким ""железом"".",Цена/Качество. Клавиатура. Дисплей. Звук.,"Единственное но - это маркая поверхность, видны пальцы на месте их прикосновения с корпусом.",5
1659,"Підкажіть, скільки у ньому роз'ємів М2 під SSD,і який максимально можливий об'єм ОЗУ.",+,+,5
1660,"Ноутбук довольно хороший, пользуюсь им и вполне доволен)) для заявленных характеристик , цена очень даже адекватная, что и делает ноутбук ещё лучше. Обработка видео, Аудио, фотошоп, игры вытаскивает хорошо. Вообще, ноутбуком доволен",Цена Характеристики Хорошая батарея Хороший экран,Нет,5
1661,"#моєрозпакування Чудовий ноутбук з IPS Full HD екраном який розкладається на 180 градусів. Дуже швидко працює.Клавіатура з приємною білою підсвідкою , з якою чудово працювати . Дуже компактний та легкий ноутбук всього 1,8 кг.Батареє має довгий ресурс. Плюс фірма виробника має хорошу репутацію і історію на ринку .В цьому ціновому сегменті на мою думку дуже хороший девайс .","Підсвітка клавіатури, 1 тб диску , дуже тихо працює , IPS , ноутбук розкладається на 180 градусів !!!","Не знімна батарея , 2 usb порти з одного боку ноутбука",5
1662,"Гарного кольору ,швидкий,майже не гуде,легкий і компактний",,,5
1663,"Вопрос к представителю. Немного не понял описание по памяти, распаяна + слот. Если я куплю планку 4GB, её туда можна доустановить ? Спасибо.",Хорош за свои деньги.,Не выявлено на данный момент.,5
1664,Ему SSD можно ещё добавить и если да то какой форам???,,,4
1665,"У мого друга такий самісінький ноутбук. Каже, що усі ігри дуже добре йдуть. І казав, що на ньому він злегкістю може обробляти 3d графіку.",Топ,Немає,5
1666,"Добрый день, хочу выразить благодарность за отличную покупку. Признаться, очень давно хотел именно Thinkpad и много чего про него прочитал, и хочу сказать хоть это и бюджетная версия Thinkpad, но все прелести этой серии соблюдены. Отличное качество деталей и корпуса, денежная система для отвода влаги с клавиатуры, его неубиваемость это просто must have для работы, дома и всех повседневных задач. Плюс его можно апгрейдить и на эту линейку действует 2 года гарантии, как показывает Lenovo vantage. Вообщем и целом, очень доволен покупкой, всем рекомендую.","Качество, производительность, влагостойкая клавиатура, ТРМ модуль, неубиваемость, возможность апгрейда, IPS матрица и отличная цена.",Их попросту нет,5
1667,Ноут за свои деньги отличный экран норм звук для ноутбука норм,Цена характеристики,Люфт тачпада сильно шумит при нагрузке,5
1668,"CS 1.6 йде без лагів , навіть здивований",Тандем hdd та ssd. Непогана зборка i5 та 1050ti,"Купляв бабусі, каже висне трансляція ""Пусть Говорять""",5
1669,"Всі зазначені характеристики відповідають. Літає, і5 8-го покоління і ССД свою роботу роблять. ВОТ на високих легко, трохи шумить. Але що ви хотіли. Екран супер, шикарна підсвітка (відключається F5). Та і взагалі доволі гарний бук. Сім років відпрацював на НР і5 2 -покоління, ще й до того на АМД відео ! І впевнений що буде довго працювати, віддав дружині. Собі рішив обновитись:) Не переживайте, дружині подарунки купив:) НР як завжди на висоті !","Екран, ССД, 1 Тб жорсткий, видеокарта. Все супер.","Трохи маркуватий, але це на швидкість не впливає.",5
1670,"Фото спустя три недели использования. Следов насобирал, не протирал еще ни разу. Кстати постоянно стал заряжать телефон через него, через Type-C телефон заряжается быстрой зарядкой",,,5
1671,"Доброго времени суток. давно собирался написать этот отзыв, но все руки никак не доходили. Приятного чтения. Владею ноутбуком с 25.12.2019г. первое впечатление было хорошее, правда расстроила упаковка, слишком простая. Читал отзывы про то что он маркий, к сожалению они подтвердились.  О недостатках: играть с ноутом на ногах нереально, сильно греется. Правда если смотреть интернет и ютуб вполне комфортно. Процессор в пике нагрузки может прогревается до 99-101 градуса. Остались плохие впечатления о материалах, дешевый пластик, дешевая упаковка. По поводу плохой партии читал много разных отзывов про плохие экраны, и в целом высокую температуру работы процессора, у меня проблема возникла с охлаждением. В начале января как то вечером засвистел вентилятор охлаждения, посвистел и перестал, легким похлопыванием по корпусу. но спустя две недели работы вовсе начал издавать душераздирающие звуки и умер на глазах. Не хотелось сталкиваться с гарантией...Об этом позже. Звук стандартный хотелось бы лучше. Клавиатура, только зеленая, работает в двух режимах ВКЛ/ВЫКЛ. А еще шарнир немного хлипкий как по мне.  О достоинствах: Цена, за эти деньги единственное сбалансированное предложение, сравнивал по оперативке(тут 16), видеокарте(тут GTX1050TI), и памяти, а именно заинтересовало SSD(256)+HDD(1ТБ), работает реально быстро, бывает ощущение того что жесткий диск слишком медленный поэтому в планах сменить на ссд. Производительность в играх не замерял (кому интересно пишите замеряю) ГТА онлайн на максимальных настройках комфортно играю. Танки на максимальных настройках 60-120 фпс. С его возможностями можно играть любые современные игры на средних-минимальных настройках, некоторые даже на максимальных. Экран порадовал, хорошо просматриваемый под разными углами. Тач пад удобный по сравнению с стандартным квадратным.  По гарантии обратился в сервисный центр 19.02.2020г и по сей день 02.03.2020г ноутбук в сервисе, ответ один, заказали запчасть (кулер) и ждут, как заберу напишу как все закончилось.  Итог: технические характеристики отличные за свои деньги, корпус симпатичный, но дешевый( понимаю что за эти деньги нужно чем то жертвовать). Рабочая лошадка, можно игры вечером поиграть, всякие программы для обработки фото и видео работают комфортно, или просто для работы, при легких офисных программах батарея живет несколько часов. Топ за свои деньги.",производительность за эту цену,"дешевая сборка, много брака в партии(у меня поломка спустя два месяца использования)",5
1672,#мояраспаковка,Комплектація-ціна,Маркий корпус,5
1673,"Ноутбук весьма приличный. Мой экземпляр пришёл в полностью запечатанной коробке, т.е. новенький, с завода (никто его не возвращал до меня). Отличная производительность. Очень доволен.","Внушительная производительность, стильный дизайн, хорошее соотношение цены/качества","Невозможность самостоятельного апгрейда без потери гарантии, маркий корпус.",5
1674,Хочу узнать так сказать о минусах или подводных камнях перед покупкой,,,5
1675,"Здравствуйте, проблемы с Wi-Fi , работает только рядом возле роутера, отошёл на метр сигнал падает до 1 палочки, драйвера ставил через HP Support Assistant, Windows 10, роутер исправный, при раздаче с телефона сигнал очень слабый, это аппаратная проблема или программная ?",,,5
1676,"Брали девушке для работы. Сама установила Винду, на первое впечатление довольны всем, за такие деньги характеристики бомба, ещё и хорошая скидка была на ""черную пятницу""",,,5
1677,"Поки все чудово, характеристики відповідають дійсності. Дизайн пушка",,,5
1678,,,,5
1679,"Пользуюсь месяц. Пока нареканий нет. Сначала показалось, что притормаживает, но потом привык. В общем - для моих целей и для его цены - вполне приличная машинка. Надеюсь , что и дальше всё будет так-же",работает тихо и не греется,"Батарея не съёмная, как написано в описании",4
1680,"При выключении выдало ""Подготовка Windows. Не выключайте компьютер"" Помогите, пожалуйста, советом как убрать обновление. Уже пол часа.. Покупка сегодня. Хелп, мне работать нужно",,Подтормаживает,3
1681,"Хороший ноутбук, видео смотреть комфортно, а этого мне хватает","Экран, дизайн",Не обнаружил,5
1682,"Отзыв будет написан после пользования старым ноутбуком около 10 лет. Ноут летает как угарелый. Когда старый ноут кипел с температурой ада, от этого ноута при касании можно замёрзнуть. Грузит игры так быстро, что не успеваешь обновить страницы в соцсетях. Процессор и оперативка решает. Видео драйвер тоже порадовал. Единственные моменты, которые доставили проблемы связаны с странностями 10 винды.","Скорость, нагревается только если поставить на плиту или костёр.","Не слышал, не видел, не заметил",5
