"Шикарный комп, доволен на все 200% брал в основном для ks go, на высоких 170-200 фпс, поставил средние теперь под 300 фпс стабильно, оперативы на 8 вполне хватает, единственное в будущем поставлю ссд, а так просто самолёт, берите смело.","Цена, качество",Нет,5
"Да, я заново пишу отзыв но только для того чтобы сказать что внутри компа. Процессор - intel core i3 9100f Видеокарта - Asus GeForce GTX 1050ti PHOENIX 4gb Мат.плата - Asus h310m r-r2.0 Блок питания - gamemax 500v Корпус - gamemax mt-520fan Кулеры gamemax gmx af12-b (2шт) Кулер chieftek d12sl (1шт) Жесткий диск - Seagate Barracuda 1tb Оперативная память - ноунейм на 8гб ддр4  Ну вроде все","Оправдывает свою сумму,в играх тянет больше сотки на макс, 3 порта usb 3.0, есть подсветка на кулерах а именно лента",нет,5
"Доволен , качественный товар .",,,5
"Дуже добре показує себе в роботі , приємниа синя підставка .","Хороше охолодження , материка і відеокарта від MSI",-,5
"Изначально присмотрелся из-за своей относительно небольшой цены и отличных характеристик. Intel i3 на Coffe Lake, который стоит в этом Пк отлично показал себя в тестах вместе с GTX 1050 Ti. Корпус стильный, на кулерах есть синяя подсветка.  Так как компьютер покупался под большинство современных игр, поделюсь тестами некоторых из них: В PUBG можно спокойно играть на низких/средних настройках и в full hd разрешении при стабильных 60-80 фпс. Battlefield 1 на тех же низких/средних настройках не нагружал фпс ниже 60 кадров (при игре на сервере с 64 игроками) Те же Dota 2, CS:GO и WoT спокойно идут на ультрах не ниже 60 фпс.  Доставили компьютер за 3 дня, что не может не радовать. Покупкой полностью доволен!Рекомендую.","Отлично показывает себя в работе, тихий и мощный, отличное соотношение цена/качевство",Немного не повезло и попался бюджетный вариант видеокарты от Asus GTX 1050 Ti Phoenix,5
"Есть один волнующий вопрос, как часто нужно его чистить и как это делать если он на гарантии?",,,5
"Взяли в основном для игр и очень довольны, Cs, wot и т.п. на максималках просто супер. Быстро загружается, тихо работает.","Быстрый, тихий, отлично тянет игры",Не заметили,5
"Комп огонь, юзаю уже 2й день пока нареканий нет. Все устраивает, ФПС на ультра в World of Tanks 80-90.","Тихий, внешне не большой.",Не обнаружил,5
"Прошу дать информацию по поводу оперативной памяти. Какая конкретно планка стоит в данном ПК? Я пол года назад приобрел данный ПК только в другом корпусе тогда был, хочу добавить ещё одну планку на 8 гб. Хотелось бы именно такую же что бы не конфликтовала мать! Напишите производителя либо дайте ссылку на данную память. За ранее спасибо!","Хорошая сборка, превзошла ожидания!","Мало 8 гб озу, 16 было бы в самый раз!",5
Задоволений!,,,5
"Довольно простой, лёгкий на первый взгляд. Кажется что по весу когда берешь в руки, такое чувство что будто ничего и нету в руках, тихий без лишних шумов, есть гарантия на данный товар, все в комплекте, тянет хорошо, можно поиграть в довольно таки не плохие игрушки,есть еще плюс того что продувает не только сзади и сбоку еще и спереди. Так сказать летом можно и вентилятор не ставить в комнате, пк охладит её:), без лишних затрат доволен покупкой . Спасибо!","Цена, Качество, надёжность",нету,5
,,,5
"Купила данный компьютер сыну, около месяца назад и осталась очень довольна. Сын говорить что компьютер тянет все игры и программы, большое спасибо Розетке за качественное обслуживание!","Быстродействие, бесшумность, хорошо показывает себя в играх, красивый корпус.",Недостатков нет,5
"Купила детям - они очень довольны, все игры тянет, с которыми предшественник не справлялся. Несколько месяцев работает без проблем",,,5
"Нормальный пк,звезд с неба не хватает но стоит своих денег","Тихий,много USB портов","Оператива 1 планкой,Одновентеляторная видеокарта",4
Сколько фпс в кс го?,,,5
Сколько кулеров на видеокарте и от какой компании?,,,5
А какой у него процессор ???,,,4
"Подключил монитор к ПК, не выводит картинку. Через ПЕРЕХОДНИК HDMI TO VGA тоже не выводит картинку, что делать ? Пк работает и монитор рабочий .",Не выводит картинку на монитор,Не выводит картинку на монитор,3
Подскажите в данной модели есть блутуз?,,,5
Круто,Зручно,,5
"условия отплаты на 10 месяцев, взял и плачу 2140 в месяц, все игры на максималках(ультрах) очень доволен. танки 130-170 фпс, зависит от карты. ведьмак все на максималках. рекомендую брать, у кого до этого было слабое железо и не менялось как у меня 8 лет(ноут)","мощь, условия оплаты",ну нету,5
Годная тачка для работы. Однозначно рекомендую!,,,5
"Вопрос по кредиту от ПУМБ. Что бы взять 10 платежей и не напрягаясь спокойно его закрыть через 2-3 месяца, нужно иметь карту в банке? Или как происходит процедура?",Цена качество,Не обнаружил,5
"Отличный пк,игры летают,metro на максимальных!!!я довольный Нужен совет,стоит ли покупать к нему ИБП?если да то какой,до этого был ноут,чуть отстал с технологиями.","Отличная сборка.тихий ,мощный.мечта сбылась)",Нету!,5
"Все работает , полёт нормальный",Качество сборки,,5
"Все, як заявлено на сайті прийшло. Даже є бонус, блок живлення на 800, а не 600. Дякую",,,5
"Вчера получил. Отличный ПК.Не греется,очень тихо работает.Производительный. Протестировал в парочке игрушек ( Witcher 3 + HD textures,Shadow of the Tomb Rider,Dark Souls 3).Все без проблем вытягивает на максимальных настройках графики в 60+ fps без просадок и фризов.Посмотрим как покажет себя дальше,но на данный момент все отлично",,,5
Компьютер отвечает по всем параметрам цена-качество. БЕРИТЕ и порадуйте себя наконец то.,"Тишина, мини тавер (занимает очень мало места)",Не обнаружил,5
"В целом сборка устраивает. Жаль, что невозможно отключить подсветку. Хотя у некоторых есть для этого специальная кнопка на корпусе","БП мощнее, чем был в описании (не 600, а 800)",Подсветка,5
Питання до виробника. Якої версії потрібен hdmi кабель?,"Тихий, компактний.",Поки що немає,5
"Metro Exodus (высокие), Pubg (высокие), Forza 4 (высокие), Far Cry 5 (Максимальные, проц грузит почти под 100% но лагов не было замечено). Комп включается за 15 секунд. Файл на 50 гиг удаляет за 0.5 секунд. ССД рулит ))","Для современных игр на высоких настройках графики хороший комп, 4 гига видухи хватает с запасом!",LED кулеры со временем напрягают (без подсветки было бы лучше),5
"Ребята, спасибо огромное. Уже 2 неделю пользуюсь этой сборкой и не могу нарадоваться. Эта сборка может уделать i5 . Всем советую, компьютер оправдывает каждую вложенную копейку. Да и дизайн не елка и вполне гармоничен. Система охлаждения справляется с задачей и шум не напрягает",Низкая цена;Комплектация;Дизайн;Производительность;,Отсутствуют,5
"Всем довольны,игры онлайн тянет,люмион 8 отлично работает.Шустрый компьютер получился за эту цену. Долго выбирали и не пожелали о своем выборе.","Гарантия три года,","Сильно лёгкий корпус,можно с лёгкостью скинуть со стола",5
"Отличный пк за свои деньги. Тянет все на максималках, очень быстрый за счёт ssd и 16гб оперативы. Единственный минус это видеокарта феникс с одним куллером, греется до 70, но в целом по производительности все очень даже хорошо!","Цена, скорость работы, внешний вид",,5
Шустрый и безшумный компьютер,Шустрый и безшумный,Нет,5
,,,5
"Товар прибыл очень быстро, товар качественный и я этому рад. Сотрудники быстро реагировали на обращения через почтовый ящик. очень доволен, спасибо огромное. теперь буду покупать у вас.","Цена, качество, скорость.",Не нашел.,4
"Отличный комп за свои деньги,желаемые игры тянет на средне-высоких.",Цена,"Нету,апути",4
"Хороша збірка, нарікань немає, все літає, фпс стабільно високий. При замовленні цікавився типом(виробником) відеокарти, сказали буде від MSI отримав з ASUS(Phoenix) Планка оперативки 1ш х 16, думаю 2х8 було б краще. Незаповнений гарантійний талон.","Вартість/продуктивність, хороший дизайн та якість зборки","Порожній гарантійний талон, неповна/недостовірна інформація по комплектуючим.",4
"Купив, все підключив, щоб самому установити Windows. Клавіатура світиться(працює). Материнська плата загружається і вилізає ""MBR Error 1 Press any key to boot from floppy"" Нажимаю на бадь яку клавішу і з'являється ще одна така помилка тільки ""MBR Error 2"". Тільки коли жму f12 то нічого не стається. Що мені можна самому зробити, щоб виправити це?",,,4
"Благодарю за пк:) Всем остался очень доволен. И приятен факт того, что все аккуратно собрано и не нахлябисто. Жаль только подсветку нельзя регулировать. Это один лишь маленький минус этой заборки, а так вообщем пушка",Цена Производительность Качество сборки,Нельзя регулировать подсветку,5
"Комп просто пушка - ракета) Пришло быстро, минуны которые я нашёл: отклеивание пломбы и с вверху сеточка от пыли немного погнута. Не шумный. Компьютер мощный, для работ в программах как Фотошоп, Синема 4д, Блендер это вообще пушечка) Конечно есть и свои нюансы если вкапываться губже (допустим октан на амд не работает и т.д). Для игр так же компьютер хороший, вот с игр я только по фану скачал Майнкрафт, доходило дело и до 2к фпс на максималках, всё таки Майнкрафт это игра не очень требовательная, основная нагрузка идёт на проц. Вообщем очень довольный покупкой, я считаю это единственный достойный пк за свои деньги. Спасибо большое)","Нету шумов, мощный.","Пломба отклеелась, немного погнута защита от пыли (сетка)",4
"Подскажите, от куда можно скачать драйвера для этого компьютера? Сидюки уже никто не использует.",Цена-Качество,Драйвера на диске.,5
"Подскажите, как можно отключить подсветку на корпусных куллерах",цена,подсветка,5
Комп просто бомба,Все круто,Нету,5
Все як в описі .Супер мені підходить живчик,Все як в описі,,5
"Не змогла оцінити якість товару. Прийшов неробочий. Не давав сигналу на монітор. Повернула на наступний день після отримання. Вже 3й день лежить на складі розетки. Досі ніхто навіть не глянув що з ним, зате кажуть що мабуть потрібен буде ремонт пт гарантії. А це явно брак і я ним не користувалася взагалі. Буду відписуватися про те як буде все далі відбуватися",ніяких,не працює,1
"Крутой комп, для своих денег",Цена,Не нашол,5
Можно ли будет поставить 1050ti?,,,5
"Покупали домой, подбирали моноблок, чтобы не занимал много места. Остановились на этой модификации, т.к. в ней 256 ГБ SSD и 8 ГБ ОЗУ. От Endless OS избавились в первый же день - слишком сырая она еще и неудобная... Windows 10 установилась минут за 8 и работает без проблем. Из минусов: периодически шумит, хотелось бы более тихой работы. В комплекте идут проводные мышь и клавиатура - тут Acer однозначно пожадничал. Динамики тоже хотелось бы помощнее / погромче. Из плюсов: в интерьер вписался хорошо, места занимает мало. Для повседневных задач хватает мощности, работает шустро. Веб-камера подключается в USB порт и крепится сверху на магните. Экран IPS.","Симпатично выглядит, компактный","Немного шумный, проводная мышь и клавиатура",4
"Сборка хорошая и довольно надежный бренд, из положительных сторон радует 8гб памяти и установленная SSD. Процессор на среднем уровне.",8гб оперативки SSD,Зачем устанавливать на комп Linux? Больно пользоваться и трудно избавиться от него,4
Тооп,,,5
"Мой предыдущий комп был настолько слабым, что в какой то момент подвисал и еле работал при запуске хрома и еще 2-3 программ, поэтому отзыв чисто на основе сравнения. И я хочу сказать что за 4 месяца работы все отлично, работает восхитительно, запускается за пару секунд винда на ссд стоит), выполняет большой объем работы одновременно. Если судить по играм, то, к примеру ведьмак на ""средне-высоких"" настройках идет отлично и шустро, если на ультрах то есть небольшие подвисания, но тут как бы вопросов нет, для ультров есть пекарни подороже. Игры помладше летают на максималках, если вы играете в дотан, майнкрафт, танки и т.п. то вам его будет более чем достаточно для максимальных настроек. С повседневными задачами справляется очень быстро и без нареканий, всякий софт адоба, видео аудио редакторы летают, видосы в 4к тянет. в общем для своих денег это просто отличное железо. Дизайн тоже классный, подсветка огонь, жаль ее нельзя регулировать, но говорят в с/ц можно поменять на регулируемую. Сам блок компактный, небольшой, единственное, что мне хотелось бы больше юсб разъемов на задней панели, но это уже субъективное, т.к. не привык еще к передней панели, но в общем разъемов хватает. В общем если вы хотите играть в современные игрухи, но не особо принципиально чтобы самые последние игры шли только на ультрах, а вам будет ок и на средне высоких, или нужна пекарня для монтажа и редактирования большого кол-ва видео или для дизайнерских программ, нужен шустрый и тихий комп, то берите. По цене/качеству это топ.",Цена/качество. Скорость работы.,Пока не обнаружил,5
Советую взять этот компьютер хороший большинство игр тянет на 60 фпс на ультрах,"Мощный пк,не громкий.Цена",Не выключается подсветка.,5
,Быстрый,Шумноват,5
"Спасибо огромное компании Artline! в сб. купил этого монстрика, но при подключении был выявлен дефект шнура питания, он не надежно фиксировался и искрил. Обратился на гарячую линию и мне сразу предложили его замену. Сегодня вторник, только что получил новый шнур по Новой Почте. Быстро, качественно и приятно. Покупкой доволен, компик очень шустрый, но подсветку иногда все же хочется и отключить )","Стильно выглядит, быстро работает",Нет возможности отключать подсветку по желанию,5
Идеально для начинающих геймеров,Топ за свои деньги,Думал обманули что vram 4 гб. Но все таки это я ошибся.,5
"Щойно забрав даний ПК з пошти, і я так розумію, що повинен здавати його назад або жити з болтом який хтось забув прикрутити при збірці.... Звичайно ж його не було чути при пакуванні, удар болта об скло або металеві детілі зовсім не безшумний... Витягнути його я можу і самостійно, але тоді даведеться зривати гарантійні пломби і втрачати гарантію на 36 місяців... Розета, Артлайн, що мені робити в даній ситуації? Болт судячи з всього, такий самий як і до жорсткого диску..",,,2
За эти деньги - идеальный вариант для офиса. Рекомендую!,"Цена, характеристики",Не нашел,5
"Работаю ежедневно более трех месяцев. Широкий круг задач - офисные задачи, просмотр роликов, фильмов, постоянно открыто около 20 вкладок. В игры не играю. В самом начале поставил дополнительно жесткий диск на 1 Тб. Все работает без вопросов.","Тихий, компактный, подходящие характеристики.",не выявлено,4
Какую лучше установить Винду на него ?,Цена,Нет винды,5
"Заказ получили весь комплект ! Все рабочее изъянов видимых нет , так ещё не разбирались особо . Не пользуемся пока по своим причинам . Спасибо розетке! Гарантийки на все что заказали есть и чек есть , звонила вам сначала не нашла , они были в упаковке новой почты вместе с мышкой. Извиняюсь не внемательная (",,,5
"Не поклали гарантійний талон,що робити?",+,-,5
