"Всем привет. Буквально неделю назад мне пришел этот компьютер. Доставка была долгой конечно. 22.10 заказал и только 30.10 получил(спасибо Мист экспресу). При распаковки заметил что сама коробка пробита, но на системнике ни чего. С комплектующими повезло, некоторые были лучше чем заявлены. БП на 800w, SSD(М2) на 500gb, операвная память две планки по 8 с частотой 3200 ггр. и так же установили еще один кулер на верхнюю панель для выдува. Касательно минусов: когда вытаскивал системник из коробки, услышал что внутри что то ""шарудит"". Кое как вытрусил - какая то отломанная железячка(маленькая). Заметил что сама кнопка включения в чем то белом(возможно была наклейка которую сорвали). Так же постоянно ""отпадает"" гарантийная наклейка(на фото видно). В первый же день после 2-3 часов работы она просто отпала. Представители Artline, я конечно ее прилепил назад но надеюсь из-за этого вы не лишите меня гарантии). Касаемо производительности, то все на уровне - летает. По играм особо не скажу, играл только в WOT и средний FPS на ультрах 110-120 кадров. При нагрузке заметил что стекло нагревается довольно сильно. Это видимо из-за того что процессорный кулер выдувает на него(лучше конечно какую нибудь башню). При установке драйверов, долго не мог поставить на видюху. Скачивал последние с оф сайта, выдавало ошибку что мол драйвер не совместим с моей виндой(вин 10 64). Удалось решить этот вопрос только после установки всех обновлений виндовса, которые мне нашло. Хотел узнать, как отключить подсветку кулеров? Облазил все - не нашел) Вообщем, учитывая большие достоинства и не значительные недостатки - системник отличный. Прикреплю еще пару фото. Если у кого то есть вопросы по нему, пишите - отвечу.","БП, оперативная память, SSD, еще один кулер на выдув","кнопка включения, греется стекло при нагрузке",5
,,,5
при підтвердженні замовлення по телефону уточнював чи корпус такий як на картинці...... прислали інший,"співвідношення якість - ціна, швидкий",немає,5
Этот SSD M.2 Apacer AST280 240GB M.2 совместим с этим моноблоком???,,,5
какая разница между робочей станцией и обычным пк?,,,5
"Подскажите, пожалуйста, есть возможность расширения оперативки? До скольки гб?",,,5
Хороший комп. Главное не дорогой,Цена,,5
А этот пушистик точно для игр?,Слишком шикарные характеристики,Я их не увидел,5
"Все работает отлично. Покупал себе без видеокарты. Вот пришло время ставить. Подскажите, станет такая AMD Radeon RX 570 4 GGB, GDDR 5? И надо ли менять БП?",,,5
"Неплохой комп,нормальная сборка.На счёт видеокарты на все 100% не уверен",Мощь,Наверное видеокарта,5
"Полёт нормальный, сборка топ за свои деньги, ничего лишнего нет, включился без танцев с бубном",Всё,"Не хватает ссд, но не критично",5
Видеокарта от Asus ? Оперативка от HyperX ?,-,-,5
,хороший проц за такую цену,,4
Какая здесь оперативная память,,,5
"Все-таки вирішив купити цей ПК. Працює на відмінно. Жаль, що не було такої ж комплектації з дисководом і картридером",Працює на відмінно,Немає дисководу і картридеру,5
А низкопрофильная видеокарта сюда не станет?,,,5
"Добрый день. оперативку на данной модели можно увеличить, какие именно можно поставить.",,,5
Какой формфактор материнской карты ??,,,4
"Исправте, в этой модели стоит процессор Ryzen 3 3200g, а не 2200g.",,,5
"Очень доволен, всё полностью устраивает!!!","Компактность, бесшумность.",,5
"Вернулся, чтобы поставить пять звезд, о чем забыл в предыдущем отзыве. Это касается и продукта, и контактов с производителем, и работы Розетки.",Одни плюсы. Самая удачная покупка года.,При всей моей скептичности- 0,5
5 БАЛОВ ЗА ВСЕ РАБОТАЕТ ОТОИЧНО.Ж,НЕДОСТАТКОВ НЕТ,Слишком быстро доставили. Отвечу на любые вопросы по системе +подарок отдельное спасибо.,5
,,,5
"Хороший, быстрый компьютер. Загружается мгновенно, сразу после включения можно начинать взаимодействовать.  #мояраспаковка","Летает, много портов, отличная работа с видео, быстрый рендеринг","Местами в течение секунды ""дребезжит"" звук (редко: 1 раз в неделю)",5
Машина работает хорошо. Вместе с ПК шол подарок беспроводные мыши и клавиатура(за что отдельное спасибо).Содержимое ПК полностью соответствует описанию.,За эти деньги лучше нет.,Нет,5
Получил пк отлично весит он всего 3.3кг место заявленных 6кг второй момент который меня заинтересовал у компа больше 3 лет гарантии вопрос как производить чистку копа присылать вам чтобы не потерять гарантию так как комп опломбирован второй вопрос нельзя ли было место диска с драйверами положить флешку так как вданом компе нет сидирома и 3 вопрос сопроводительные документы а именно накладная напечатана на половину обрезаная также как и гарантийный талон нет подписи и печати не на одном документе фото постараюсь прикрепить дальше отзывы напишу когда запущу эту чудо машину,Запущу отпишусь,,2
А разгонять проц можно или только память,,,4
"Дуже сподобалась збірка. На що розраховував, те і отримав. Doom 2016 на максимальних налаштуваннях літав близько 70-80 кадрів, також пробував на Biohazard 7 та Mafia III і вони теж йшли без проблем. До того, щоб протестувати при роботі в програмах ще не дійшов, надто іграми захопився. В комплекті всі складові від ASUS, відеокарта з одним вентилятором nVidia GTX 1050Ti Asus Phoenix (PH-GTX1050TI-4G), спочатку переживав що одного вентилятора буде замало, але як виявилось - не мало. Близько десяти годин гри без перестанку - температу вище 68 градусів не піднімалась, працює тихо.","Потужний, тихий, хороші складові за хорошу ціну",За пів року користування - не виявлено,5
"Пришло на день, позже. Комплектующие, не те что заказывал, Но в плюс мне, вместо 1 терабайта hdd прислали 250 ссд и видео другое а так все хорошо спасибо. И если вы меняете комплектующие, предварительно желательно перезванивать, могло не подойти.",Нормальная сборка,"Если меняете, надо оговаривать.",4
"Первым делом хотелось бы отметить кое-какие неточности в описании. Частота памяти указана 2666 МГц, но в моноблоке стоит планка с частотой 2400 мегагерц. Так же в комплекте должен был быть диск с драйверами (судя по характеристикам), но его в коробке обнаружить не удалось. На сайте Артлайн данной модели компьютера тоже не нашёл и пришлось скачивать их с сайта производителя материнской платы. Теперь немного о самом моноблоке. Внешне он выглядит так же красиво, как и на фото :) Подставка крепкая, сразу это ощущаешь взяв её в руки. Удобно регулируется (хотя, как я понял, высота направляется с помощью пружин, и как долго они смогут сохранять форму не знаю, надеюсь, что долго и моноблок не будет падать). Все разъёмы тоже на месте. На очень неудобном месте, если посмотреть на фото. Но это не является критично важным моментом, и я прекрасно осознавал данный факт при покупке. По бокам присутствуют динамики (на фото не разглядел изначально и был приятно удивлён их увидеть вживую) Экран. Очень непривычно пересесть на почти 24 дюйма после ноутбучных 15.6. Но к хорошему привыкаешь быстро. IPS матрица радует. Я далеко не знаток всех тонкостей цветопередачи и с профессиональной графикой дела не имел, но картинка на экране хорошая. Было у меня сомнение по поводу ""зернистости"", но на расстоянии более 50 см пикселей не заметно и изображение чёткое. Рамки минимальные, на матрице они тоже есть, почему-то на фото в описании их не видно. На моём фото их можно увидеть. Производительность данного аппарата оставляет пока лишь положительные впечатления. Установка операционной системы Windows 10 через USB 3.0 заняла 7 минут. Аудио софт тянет отлично (собственно для этих задач я его покупал). Частоту процессора выше 2.8 ГГц в диспетчере так и не увидел, наверное поэтому и кулер работает очень тихо. Как себя покажет компьютер в плане игр не знаю, не увлекаюсь. Зато 8К 60 fps видео с Ютуба тянет отлично. В общем, приятно работать за данным моноблоком.","Производительность, внешний вид, IPS матрица",Пока не обнаружил,5
Бомба,Быстрый,Нету,5
"Покупал ПК не здесь в июне 2019 года и разочаровался! Много лагов появилось,сборка не качественная! Начал шуметь,поехали в артлайн,почистили,чтоб гарантия не слетела,но ничего не поменялось! Как шумел так и шумит!",Неплохая цена учитывая прайс,"Со временем начинает шуметь,иногда бывают сильные лаги,может полностью зависнуть ПК, некачественная сборка!",2
"Рекомендую всем, кто хочет построить недорогую и приемлемую в наше время игровую систему!","Цена, известные качественные марки комплектующих, небольшой размер.",За такую цену нет.,5
"Это именно что базовый комп, с приличным процессором, на который в дальнейшем можно навешивать остальные девайсы. На момент покупки - лучшее найденное мной предложение в своем ценовом диапазоне (10к грн). Если докупить еще какую-нибудь приличную видеокарту ( gtx 1060 6gb, например) - будет уже игровой комп с запасом прочности в 3-5 лет.",Вполне достойный системный блок начального уровня.,За такие деньги - недостатков нет.,5
"Швидко доставили, легко встановив, ! Єдине нерозумію навіщо диск з драйверами, якщо дисковод непередбачений!? А так все норм!""","Тихий, швидкий, зручний, простий!",??? Ще незнаю!,4
Фортнайт і гта5 піде?,,,5
"Купив, все влаштовує, комп літає. Гарантійний талон на 36 місяців теж є. Користуюсь третій місяць зауважень нема.",Швидкість,Не виявлено,5
А оперативная память от какой компании?,,,5
Не работают разъемы передние...,Цена качество,"встроеная видяха, не работают передние разъемы для наушников и микрофона.",4
"Постоянно отваливается соединение с сетью. На значке сети красный крест, выдает сообщение ""сетевой кабель не подключен"". Ничего не помогает кроме полной перезагрузки. Из пяти системников, купленных в офис такая проблема у двух. Прийдется докупать сетевую карту. Как то так.",Быстрота,проблемы с сетью,5
а HDMI нет?,,,5
"Хороший не тяжелый системник с нормальными характеристиками. Я как бы расчитывал линукс поставить и пользоваться системником. Но 16.04 стал и не смог я разрешение экрана поменять, и все статьи перегуглил и с линукс кернелом баловался, ничего. Такая же история и с 17.10 и с мятой. Пришлось пару деньков на десятке посидеть, там все хорошо конечно. Но, вот вчера выходит Убунту бионический бобер и там все работает прекрасно.","хороший системник, компактный, хороший процессор в этом ценовом сегменте. Оперативы на сегодня тоже хватает. 240 ssd в самый раз ну и плюс на терабайт hdd.","отсутствие hdmi порта, а если учесть, что при моей покупке он был здесь указан в характеристиках, то недостаток вдвойне. Так же не каждый линукс сюда установить.",5
Fifa 19 пойдет,,,5
"Брался взамен ноутбуку 14-летней давности и поэтому этот контраст очень разителен начиная от скорости работы конечно же, эргономичности, как удалось втулить все в этот корпус, включая винду 10про, а сенсорный экран это вообще отдельный разговор. Родителям в нем нравится все. Эдинственный условный недостаток - пришлось докупать клаву с мышкой, но опять же зато взяли ту что хотели.","Большой, т.е. все хорошо видно, и в то же врмея компактный, быстрый, очень красив.","Время покажет, а пока что все работает как часы.",5
"Он никак не игровой. I3 этого мало, уже i9 есть. Видимо с охлаждением есть проблемы если i3 только ставят...",Хороший фарш.,Проц.,2
"Власне особливо коментувати нічого. Для чого купувався - відпрацьовує. Не дуже розуміюсь на сучасних іграх, але запускав Total War: Warhammer Fantasy - все працює без лагів і як потрібно. Не знаю, чи це показник. Можливо трохи шумить, але це а) суб'єктивно і б) цього можна очікувати за такого БП і кількості різних кулерів. Зі свого боку можу рекомендувати.",Швидкий :),,5
"я так понял мать и видяха asus,а оперативка,блок и жесткий диск от кого:?",Цена,Охлаждение,4
"Есть место, чтобы добавить ещё 8 гб оперативной?",,,5
А скільки тут ще можна встановити оперативної памяті? І скільки максимально?,хороший ПК,Немає,5
При покупке процессор будет с разгоном?,,,4
Очень доволен пк!,"Не гудит, довольно тихий, а самое главное - мощный",Не обнаружил,5
"Использую неделю. Проблем вообще не возникало. Все настроилось и шустро работает. Сборка для очень комфортной работы, особенно с приложениями, которые пожирают оперативу ""ведрами"". Процессор и SSD работают без притормаживания. Удобно что модуль WiFi уже на борту.  Вообще вся подготовка к работе ПК - это сам ПК и флешка с Вин10. Диски не нужны по факту. Во время установки винды все настроилось, в момент первого запуска уже была установлена утилита, которая скачала и установила необходимые драйвера.","Компактный, легкий и не шумный",Пока не заметил,5
"пользуюсь более полугода, отличная рабочая машина.",хорошая производительность по отношению к цене,"как для рабочей тачки, нету",5
"Когда вырасту и стану профессиональным графическим художником, обязательно куплю себе такой:)",Неплохая станция для работы с графикой!,Неудалось потестить (пока:)),5
Как установить свой картридер чтоб не потерять гарантию?Ну и видеокарту естественно!,,,5
Вын з дисководом,,,5
"Добротный, быстрый ПК. Пользуюсь уже около двух недель, полёт нормальный.","Цена, качество",Не обнаружены,5
"Купил около 2х недель назад. Сразу предупрежу, что ничего кроме Win10 на него не поставишь, ибо драйвера на видеокарту только совместимы с этой ОС. Вроде все норм работало, но тут я решил поставить и поиграть в Доту 2. Играю 2 минуты и стоп-машина. Либо про100 викидывает из игры, либо полное зависание компа. Решил что проблема в ОС. Переустановил (со всем используемым софтом это был очень трудоёмкий процесс). Обновил драйвер на видеокарту до последнего... и ничего не помогло. Решил было уже списать на доту. Поставил World of Tanks. При чем в настройках установил низкую графику. И что вы думаете? зависания прекратились) Просто начало выкидывать из игры во время боя. В общем однозначно я поторопился с покупкой и абсолютно не рекомендую данный системник",ОЗУ,ВИДЕОКАРТА,1
Я бы себе купил такую сборку. Не ровняйте сборки только к играм. Эта сборка в полне отличная для графики и тому подобное.,,,5
"Использую около 2 мес как домашний комп, работает под Вин10. Видео онлайн в ХД, документы и тд. летают. В игры не играю.","компактный, очень тихий, после старого ПК с куллерами, кажется, что он не включен","когда выключен, издает какой то низкочастотный шум типа писк или что то такое, сильно светится в темноте",5
Здравствуйте! возможно ли потом доставить видеокарту? 1050 ti 4 gb ???,1,2,5
"Продали системный блок, где вместо процессора Intel core i39100F стоит Intel core i38100, который на сколько я понял дешевле и на несколько лет старее.",,,2
Обалденный пк по характеристикам .Но я не знаю потянет ли он гарден варфаер.,Не плохие характеристики.,Я не знаю можноли в будущем абгрейдить.,4
,,,1
Какіе игри пойдут,,,2
"Покупали не для игр, ожидания оправдал.","простой, ничего лишнего. со своими задачами справляется на все 100%",не обнаружено,4
