"немного не привычно, что вентилятор издает немного шума, так как он встроен в моноблок","Выбирала моноблок по экрану - и не ошиблась! Монитор отличный! Картинка - яркая, живая! Антиблик и матовость дают возможность работать даже при прямом солнечном свете! Сам комп с отличным быстродействием, если систему поставить на SSD",-,5
"По характеристикам видно товар отличный, и большой дисплей))Это очень круто, хочу заказать))",,,4
,,Цена,5
,,,5
"Привезли 20го марта, два вечера работал нормально. Сегодня видеокарта начала выдавать артефакты (см. фото). До этого уже покупал компьютер от компании Artline, через пол года эксплуатации возникли проблемы с процессором (заменили оперативно, за что спасибо), компьютер работает и по сей день (2.5 года уже).  С этим же, надеюсь, получится уладить вопрос так же быстро. По результатам отпишусь.",Два дня проработал нормально.,Перестал работать через два дня.,1
"Хорошо собранный, быстрый ПК, стоит своих денег","Хороший быстрый ПК, стоит своих денег",не нашел,5
"Отличный пк, брал для игр. Тащит все на ультрах. Всем доволен. Очень классный комп, всем советую","Мощный, тихий",Нету,5
Здраствуйте пк непоганый ну канешно тяне не все хеви рейн не тяне .,Радуе стоимость продавав виныкы на базари за одын сезон заработав,Пока не обнаружыв,5
Гта 5 на ультра настройках пойдет,Нет,Дорого,5
"Комплектація відповідає заявленій. Працюю за ним кілька днів. Шумить не сильно. Вантажиться за секунди. Вмикаю підсвітку тільки для гостей(сама по собі відволікає). Брав не для ігор, віртуалки бігають швидко, відео рендериться без проблем. Чудова робоча станція, раджу. Сподіваюсь система живлення буде жити довго) Зіткнувся з ситуацією, що на кришці сама по собі відклеєїлась наліпка гарантії... цікава відповідь представника компанії.","Сучасна комплектація, тихі куллери, можливість встановлення водяного охолодження, 4 слоти ОЗУ, що дає можливість апгрейду. Швидкий nvme-накопичувач. Багато USB роз'ємів.",Відсутній type-c роз'єм. Слабкий клей на фірмових наліпках гарантії.,5
Где находиться DisplayPort я просто не могу понять,,,4
"Працювати на ньому - одне задоволення. У порівнянні з моїм стареньким Core і3 530 першого покоління, і7 дев'ятого покоління - ракета!!!","Потужний процесор, надшвидка SSD, нешумний.","Відсутність дискретної відеокарти не всім підійде. HDD то вимикається, то вмикається з інтервалом в 5 хв., що дратує через звук розгону.",4
Какой процессор в ARTLINE Businеss Plus В59v22 - I7-9700 или I7-9700K?,,,4
"Классный компьютер как за свои деньги, по сравнению с моим ноутбуком, он пушка",Все выше написанное,Нету их,5
,Относительно бесшумно работает,Небольшие кнопки питания,5
"Добрий день! Підкажіть будь ласка, чи буде та збірка шо є в тому системному блоці, в майбутньому підтримувати відео карту GTX 2080 Ti??? Дуже дякую",,,5
"Замовили, дуже швидко приїхав,на Новій пошті відкрили,щоб перевірити, і були сильно розчаровані, товар з пошкодженням бокової скляної частини, відразу склали акт і повернули. Товар у такій ціновій категорії, не може продаватися в такому стані.Чекаю на відповідь представників Розетки.",,Товар з пошкодженням,1
Кабель hdmi 2.0 подойдет ???,,,5
"Товар в процессе тестирования, на вид вроде все норм! Жаль что подарок мне ввиде игровой мышки не достался! Причина мне тоже не известна",Еще не определил в процессе,Нет подарка,4
"Очень неплохий товар за свои деньги, по сравнению с конкурентами!!",Цена Размер,"Видеокарта могли поставить получше конечно, но 1660 пока хватит на любые потребности",5
"Принял товар, нареканий на работу нет, все работает,только опять же сорвана одна пломба,со стороны стекла!","Стильный,красивый, за свои женьги норм,чего ожидать, гарантийник есть ,печать стоит","Сорвана пломба, очень печально",4
"Средней мощности комп,не доконца вставлена оперативки,сорвана пломба на крышке",Корпус,Сорвана пломба и не качественная зборка,4
Гта 5 на середніх настройках потягне.,,,5
Что за Блок Питания?,,,5
HDD с MLC памятью?,,,5
Скажите пожалуйста... какой тип SSD устанавливают?,,,4
"Придбав даний товар безпосередньо у продавця, прийшов в комплекті з клавіатурою та мишкою, що стало приємним доповненням до самого ПК. На рахунок роботи: працює плавно, стрес-тест пройшов на ура. При максимальному навантаженні тримає стабільну температуру. Щодо роботи: програми запускаються швидко, як і сама ОС (Win10) завдяки SSD, швидкий у всіх аспектах, якщо користувач не надто вимогливий. Щодо ігор: усі сучасні ігри тягне на максимальних налаштуваннях. І навіть не зважаючи на доволі переконливу націнку (близько 7+-1к грн.) все одно радий факту наявності 36 місячної гарантії на комплектуючі (хоча одна з наклейок, яка мала б слугувати пломбою на корпусі була відклеєною ще при розпаковці).","Швидкий, відносно компактний, корпус прекрасно продувається, прекрасно справляється з поставленими завданнями, приємний бонус: кабель-менеджмент","В момент покупки ціна була вища і націнка була найбільш помітна, недолік незначний, на мою думку",5
"Купил ребенку на замену старого. Для игр и рендеренга видео. Ребенок доволен как слон. Все игры, включая тяжелые, ставит на максималках, ""тормозов"" не замечено.",,Не обнаружено.,5
"Отримав цю конфігурацію в іншому корпусі, як у цієї моделі: https://hard.rozetka.com.ua/ua/artline_x92v11/p183995267  На щастя, такий корпус мені більше сподобався візуально.",Відносно хороше впіввідношення ціна/потужність,"Немає інтегрованої графіки про всяк випадок, але це не суттєво",5
Норм ПК для игр отличний,Нет,Нет,5
"Комп замечательный за такую цену. Недостатков нет. Отличная видеокарта, nvidia 1050ti, которая тянет любые игры на высоких или ультранастройках, хорошая система охлаждения - в играх комп никогда не нагревается, очень тихий - почти не слышно куллеров. Для нормальной работы nvidia нужно установить дополнительные драйвера, так же можно установить программу Geforce Experience - для дополнительной оптимизации игр и для более качественной графики. Единственное чтобы хотелось добавить в эту сборку это SSD. С установкой windows 10 никаких проблем не было, так же нравится что вход/выход на наушники и микрофон расположен спереди - это очень удобно. Процессор тоже радует, он достаточно мощный, даже в играх максимально использую 60 % от cpu. В общем если кому-то нужен хороший бюджетный вариант для любых задач этот комп вполне подходит. В будущем конечно можно заменить видеокарту 1050ti на 1060 к примеру, но сейчас и 1050ti вполне достаточно - так как фпс ниже 50-60 не замечено(в самых требовательных играх).","Хороший процессор, мощная видеокарта, высокая производительность, множество портов, оптимальное энергопотребление.",за такие деньги просто нету,5
"Пользуюсь пк, уже 1 месяц в играх проблем небыло все игры тянет, танки ультра 70-120 фпс, ксгоу самые высокие 200-300, гта 5 с модом на графику и ультра настройки + еще моды 50-80 фпс, фортнайт эпические 150, watch dogs 2 ультра 60 фпс, не грееться не шумит после пару часов работы он холодный. Главное установить все драйвера советую Nvidia Experience, еще была проблема при включении пк не было интернета парился с этой проблемой очень долго, приходилось туда сюда высовывать кабель проблема была не в пк, а в самом интернете надо было зайти на сайт вашего провайдера и добавить новый ip и тогда всё всё отлично еще советую не ставить 7-ку на данное железо оптимизация там нулевая, на десятке летает. Всем советую именно данный пк.",Все,Нету,5
"в общем, пришел позавчера этот кусок железа, пришлось повозиться с виндой(в процессе установки возникли трудности)...но потом все же залив винду и установив все дрова аж душа запела, в асасине ориджин на высоких фпс 50 + -, в танках на высоких примерно 130-150, в общем оно того стоит, 1050ті cебя оправдывает по полной, всем советую. И отдельно вопрос к админу(или представителю), если захочу открыть когда-то крышку и почистить от пыли, как быть с гарантией??",,,5
"Пользуюсь месяц, доволен полностью. Докупил планку на 8gb, хотя он и с дефолтными комплектующим работал отлично. Игры тянет без проблем на высоких-ультра настройках. Проверял (The Witcher 3, Dishonored 2, AC Syndicate). Очень хорошее сочетании видеокарты и процессора. Охлаждение на уровне. Взял к нему монитор Samsung Curved C24F396F, вместе работают отлично, не ссорятся)) Брать стоит, за такую относительно не большую цену, так что рекомендую!","Тихий, быстрый, хорошее охлаждение, удобное расположение портов USB и кнопки питания.",За месяц пользования - не выявлены.,5
"Лучше всего ставить windows 10,она сама найдет драйвера,с установкой windows 7 сразу возникнут проблемы ,из-за материнской платы. Сам пк показывает себя на высшем уровне в играх,с функцией вертикальной синхронизации фпс четко 60,так как все тесты проведены мной в мморпг(Tera,Blade and Soul,Black Desert),там фпс в огромных скоплениях игроков,городах,может упасть до 40,но при этом фризов не наблюдается,что очень радует,ведь обычно в таких местах игроки с железом послабее видят слайдшоу. В принципе для такой производительности,возможно,стоит покупать монитор с герцовкой выше 60,но меня все устраивает,главное выбрать правильную матрицу монитора.","Сбалансировная сборка,процессор раскрывает возможности видеокарты полностью,оперативной памяти достаточно.",Для меня нету.,5
"Купил не жалею , получаю массу удовольствия от работы , игры тянет без проблем , комплектация сборки на уровне в общем советую",,,5
А каких фирм комплектующие подскажите пожалуйста??,,,5
Берите!,Цена/качество.,Нет.,5
"Дуже класний комп'ютер) Тягне дуже великі ігри, без глюків,в роботі просто чудовий, з мінусів я б сказав що комп'ютер не є таким тихим, він гучний, як не як але два великих вентилятора на корпусі та по одному на відеокарті та процессорі дають про себе знати, а кому це буде не мішати тому і рекомендую","Процессор, відеокарта",Шумний комп'ютер..,5
Подскажите Виндоус 7 я смогу на него установить !? Ответьте я готов делать заказ просто мне нужна именно 7 винда ....,,,5
"Все супер! Очень доволен компьютером. Ведьмак 3 на запредельных настройках без сглаживания примерно 30 фпс. Температура максимум доходила до 71 градуса, в простое и браузере 28-30 градусов, в комнате не жарко","Характеристики, сборка",Пока не заметил,5
"Уже пару месяцев работаю на нём, всё отлично. Даже все новые игры тянет, на средних настройках с FPS выше 60. Естественно докупил оперативы 8гб. SSD на 250гб, кароче - РЕКОМЕНДУЮ.",Цена-качество полностью соответствуют (это хорошо).,Всё супер.,5
Тянет большинство игр на максимум итог топ за свои деньги,Выглядит выдержанно и стильно,Нет,5
"Незначна проблема з вирівнюванням відеокарти, але її легко виправити. Усього 8 фанів! Тепер це джерело живлення потужністю 800 Вт, а SSD тепер - 500 Гб. Я поєднав це з монітором BenZowie XL2411P 144 Гц. Цей комп'ютер працює круто, навіть в умовах напруги, він досить тихий за кількість вентиляторів. Я на 100% рекомендую придбати це, якщо ви шукаєте солідний ігровий комп'ютер, ви не пошкодуєте!  Я б знову придбав цей комп’ютер, якби мені було потрібно два-три :-)  Порада: Не кладіть цей комп’ютер на підлогу, як це робить багато людей, заглиблюйте його на стільницю, щоб уникнути пилу та бруду, які потрапляють на землю, це проста фізика. Бруд викликає більше нагрівання.",Дивовижні в усіх відношеннях!,Немає,5
"Классное решение! За эти деньги вы НЕ СОБЕРЕТЕ компьютер мощнее т.к. тут уже есть огромный высокочастотный монитор! Про аналогичный ноутбук вообще молчу (lol). Посмотрел на сайте артлайн, судя по чиспету, тут даже материнка неплохая (в отличие от другой модели, где поставили i7-8700 БЕЗ ВИДЕОКАРТЫ на материнку asus prime H310m-k). Правда я так и не понял что это за чип. Думаю, с таким развитием, скоро моноблоки будут популярнее стационарных ПК (а что, железо все десктопное, возможность апгрейда в основном, есть...зато нет отдельного корпуса, который пылится где-либо). Вот не было бы у меня стационарного ПК, взял бы этот.","i3-9100f+gtx1650 (высокочастоный 4х ядерник + неплохая бюджетная карточка). 27дюймов, 144гц! БП от FSP","непонятный чипсет, но тут надо разобраться. БП от FSP но всего на 250ватт",5
Классный комп,,,5
Кокой блок питания?,,,5
Вопрос к представителю компании: можно ли отключить подсветку на кулерах?,Еще не купил,Пока не знаю,5
неприятно,пока все норм,планки оперативки 2 по 8,5
"Покупала здесь на Розетке, для обучения работы в Майя, рендерингу. Товарищ, который сам занимается видео обработкой устанавливал все программы на него, сказал что компьютер ""ракета""! Себе так же хочет купить.",,,5
"брал для игр, доволен","отличная сборка,на эти деньги",нет,5
А можно добавить HDD ?,,,4
Нормальний комп!! Все працює!!!,"Компактний, потужний, оптимальний!!!",Поки нема,5
Какая тут мат. плата? Планирую брать!,Не купил,Не купил,5
А для игр норм будет,,,5
Чекаю відповіді.,Потужний та швидкий. Ціна адекватна.,"Товар був проплачений у п'ятницю, але видали лише у вівторок. Згідно фотографій на радіаторі процесора повинна бути RGB підсвітка. на корпусі знизу під склом також повинна бути лінія підсвітка. На комп'ютері вищезазначені аксесуари відсутні.",4
Можно будет поставить оперативную память с большей частотой?,,,5
Warface на 1920x1080 на максималках сколько фпс будет?,,,5
Сколько будет ФПС Battlefield 5 на высрких/ультрах в 4к? Заранее спасибо!,,,5
Есть какой-то видео обзор ?,,Нету,5
"Судя по фото, ""бэкплейт"" сверху видеокарты с одной стороны и здоровенный куллер с другой практически полностью перекрывают доступ к заглушке на PCIe. На моём текущем Х77 ровно такое-же неудобство.  Подскажите, возможна ли ситуация, что при последующей замене видеокарта полностью закроет эту заглушку? Как вообще правильней её снимать в данной ситуации?  Спасибо!",,,5
Можна буде поставити вайфай модуль???,"Вигляд,процессор,відеокарта,іпамять.",,5
По мне лучший ПК за 2019 2020 год,,Их нет,5
А потянит гта 5 (если потянит сколько фпс будет),Все,,5
"Все-таки купив його, але не тут, забрав у місті через інший магазин ) Другу неділю юзаю, поки все добре. Комплектація прийшла трішки краща - озу 3200 замість заявлених 2666 та охолодження процесора - wraith max а не spire ... За що вдячний ! Компактний, скляний, красивий. Після ноутбука шум трішки помітний, але ви самі розумієте, після ноутбука =) Десь вичитав, що ryzen 2600 не дотягує gtx 1660ti, для мене поки вистачає, тестував на GTA 5, battlefield 1 та Total war Attila - дає максимум, який підтримує екран - 75 Гц. Якщо хочете таку збірку, рекомендую з SSD, його не вистачає при завантаженні програм та іншого ... Єдиний недолік, не знаю чи це пов'язано зі збіркою, чи ні ... Періодично не працюють виводи USB при ввімкнені комп'ютеру, тобто мишка чи Wi-fi адаптер та рідше клавіатура не хочуть працювати після увімкнення, що виправляється повторним включенням. В цілому - задоволений, та ще раз, вдячний за додаткові характеристики заліза.",,,5
Какой тут БП стоит? И память в двуканале?,,,5
Мне очень понравились хотелось бы купить и на обзорчик))),Соотношение цены и качества,,5
