"Вчера ко мне приехал этот зверь.Заказал именно его,без отзывов других и не прогадал.Вот решил помочь другим с выбором.Начну по порядку.Цена:учитывая цены на рынке,это самый оптимальный вариант и этот пк стоит каждой гривны своей цены.Как и обещал.Железо: Видеокарта однокулерная Asus Phoenix 1050ti(как по мне хорошая бюджетная видеокарта),жесткий диск Toshiba marks 1 tb,оперативка Adata ddr4-2666(i3 видит только 2400,расчитано на апгрейд процессора).Материнка не поддерживает 60 ом.Теперь тесты в играх.Их немного,так как еще не всё успел установить.Как меня просил Андрей,Fortnite FullHD высокие настройки и ниже 60 fps не было.Моя любимая игра Witcher 3 на высоких FullHD 40-50 fps.Division ультра FullHD 30-40 fps.Пока это всё.К покупке советую.Будут вопросы то пишите в ответы.Также пишите название игры для проверки и я обязательно проверю.","Цена,производительность",Пока не заметил,5
"Соотношение цена-качество великолепное все игры на которых проверял тянет на высоких либо ультра 40-60 проверял на таких играх как: ведьмак 3, хитман, деус екс манкед дивид,масс эффект андромеда, бетмен рыцарь аркхема,тотал вар вархзамер 2.","Цена,качество,тихий",пока нету,5
"Придбанням задоволений на всі 100%. Доставили за 2 дні. Тестував в Fallout 4 на високих fullhd 50-60 фпс, World of Tanks 1.1 на високих full hd 80-110 фпс залежно від карти, Rust середньо-високі full hd 50-60 фпс, War Thunder на високих full hd 80-90 фпс.","Потужний, хоча й бюджетний",Немає,5
"Купил этот ПК еще в сентябре, но пишу только сейчас. До этого так сказать тестировал. Ребята, ПК отличный. Dark Souls 3: 60 фпс на ультрах , баттфронт 2:55 фпс на высоких. Тихий,мощный. Тьфу,тьфу тьфу,пока проблем не было. Разве что немного заедал куллер сзади но парни из Artline быстро все исправили. В общем рекомендую, для более-менее современных игр до 2018 года пойдет на ура! Спасибо ребятам из Artline и Розетке!",Весьма мощный ПК за сравнительно небольшую цену.,Не обнаружил.,5
Фаркрай 5 високі 40 фпс Ведьмак 3 високі 40-30 фпс Ще потім добавлю пару ігор і фото.,"Тихий,гарний,легкий.",Процесор під час ігри в фаркрай 5 гріє до 75 градусів,5
"Купила неделю назад. Отличное железо, шустрый, тихий, не греется. Ведьмак 3 на высоких просто летает, никаких фризов. Тоже самое Dragon age Inquisition, Fallout 4, HOTS. Это то, что успела поиграть.","Отличное железо,цена",нет,5
Всем привет! Приехал быстро! Оплата коротко и ясно ! Комп хороший!,Наверное есть,Надеюсь не будет,5
Здесь установлены сразу драйвера?,Хороший по мощности и цене!,Нет,5
Комп то что надо . Все сбалансированно и качественно. Работает тихо и спокойно . Пользуюсь неделю пока все гуд . Хотя если б что-то было то уже было б понятно . Если кому интересно то wot на hd клиенте с модами и на ультрах со всеми эффектами от 70 -120 фпс. Думаю достойный показатель за такую цену.,"Тишина , мощь , и хорошая работа. Дрбавить еще сюдда ссд диск то вообще зверь",Пока не заметил. Да и думаю их нет,5
Топ,Все работает отлично,"Отклеилась 1 пломба, когда доставал с коробки на почте",5
В техпідтримку так і не достукався щоб гарантія не злетіла.. Зайти на оф.. Сайт... Не вдалося і форму для заповнення скачати і заповнити теж не вдалось як нижче в описі... Взагалом цей комп.. Супер бюджетний ігровий можна назвати без проблем на 2018р.. Від моменту покупки цього пк. Я замінив в ньому проц на і5 8400. І дочепив ще одну планку озу.. На 8gb 2666 така в ньому стояла на момент покупки... Ще в планах замінити 1050ті на 1060 .. Материнська плата теж більш бюджетна Asus Prime 310 m-k. Но комлектуючі які я замінив вона витримає без проблем це максимум що можна тулити на цю материнку! .. Поки все літає норм задоволений.. Раджу брати готові зборки самому складати собі дороже! Повірте наслово...,Ціна на комплектуючі взагалом! Супер варто брати... Акуратно зібрані кабеля і т.д. Все заховано нічого не плутається під руками!,Не втримався і розібрав! Ну тут моя вина питань не має... Але не можу зв'язатись з техпідтримкою артлайн як я вже казав вище...,5
,,,5
Відмінний варіант для офісу!,"Ціна, компактність",не виявлено,5
"Компьютер хорош за свои деньги Windows 10 Home запускает за 6-8 секунд что довольно шустро. Игры Facry 3 идет на средних настройках на 60 FPS, GTA IV на 25 FPS Мафия 2 на 35-40 FPS довольно играбельно Нехватает конечно дискретной видеокарты хотябы слабенькой",Хороший компьютер за свои деньги,"На передняя панель с одной стороны чуть отходит или не дожата, диск с драйверами идет в комплект но дисковода та нет моглы бы флешку кинуть",4
какую сюда оперативку на 16gb можно поставить хорошую?,-,-,5
Ігри останнього покоління працюють на високих та ультра настройках при 60 fps.,Найкраще співвідношення ціна-якість.,Неправильно вказаний параметр (процесор без Х),5
Якого виробника тут материнська плата,,,5
Класний комп,,Всеж не вистачає сідірома,5
"Неплохое рабочее решение для большинства простых задач, хороший комплект за свои деньги.","SSD, скорость работы",небольшая производительность видеокарты,4
"Покупался для домашнего медиа сервера dlna. Ubuntu, minidlna, док-станция 4xHDD. Легко интегрировался в сеть. Управление удаленно с ноута или телефона. Работает без монитора, клавиатуры и мышки. Супер-компактный. При одновременном копировании файлов с диска на диск, плюс воспроизведение 20Гб файла на ТВ - ""холодный"", Загрузка процессора менее 10%.",На 100% соответствует ожиданиям. БЕСШУМНЫЙ,слишком яркий светодиод в кнопке питания,5
"Хороший неттоп для несложных задач. Поставил его, как прокси сервер. Материнка от Asus, нормальная память и SSD, можно поставить вторую планку. Два SATA 6gb. Абсолютно бесшумный. Если нормально загрузить, то радиатор прилично греется, на этот случай не хватает крепления под кулер(питание под кулер есть).",Тихий. Есть возможность апгрейда.,Не предусмотрена возможность установки кулера.,5
Гарний по ціні та характеристикам,,,5
"Купил компьютер,все отлично ,не понимаю лишь одного почему не крутятся вентиляторы на видеокарте,ответьте пожалуйста,ещё не подключён кабель PCI-E","Производительность,цена","Кроме того,что перечислил ,нету.",3
"Пройшов місяць після купівлі. Все працює, як і має бути. В офісних задачах температура ЦП 35-38, ГП 31. При іграх ЦП 51-54, ГП 71. 1920*1080 Metro Exodus - високі - 50-60 FPS Деколи просадки до 45 Відьмак - високі - 60 FPS ниже не падало (в Новіграді не тестилось) PUBG - високі - 60-80 FPS Всякі Dota, WoW, WoT, CS GO навіть тестувати немає змісту, там все ОК. Єдиний недолік - це раз в пару годин ""клацає"" щось, скоріше за все БЖ. Звук аналогічний як при вимкненні ПК. Сподіваюсь це норма. Вибір в основному був зроблений через зовнішній вигляд, корпус гарний, компактний і світиться як новорічна ялинка. Ну а характеристики дозволяють через 38 місяців (після закінчення гарантї) замінити відеокарту на актуальнішу на той час, а зараз для FullHD 1650 достатньо.",+,-,5
"Враження за перші години: windows 10 поставилась на ура, літає. Під час збирання підставки, треба хрестовидну викрутку))) Там є 5 болтиків. Плівка пакувальна покрила все, але коли приєднували частину, де ссд, кулер і т.д., то впихували з плівкою в монітор. Тепер треба якось плівку витягувать. Звук можна якось покращити, бо так, наче з нетбука, якому кілька років вже. Чи це ""Артлайн"" такі динаміки ставить? На максималку ставиш, то наче прості за 100 грн динаміки. Треба під'єднувати свої( Це не сподобалось. Окремо штекер для звуку то є, я думав буде якесь покращення, але ні... Може порадите щось? Драйвера качав з оф сайту.","Хороший екран, все ставиться, літає. Багато роз'ємів. Але 2 входи для навушників і мікрофона, то забагато...)","Звук; незручно, що кабель від під'єднаного монітора перекриває роз'єм для підключення другого монітора.",5
А он PUBG потянет на високих??,,,5
"Комп компактний і легкий. Встановив windows 7 ,поставив всі драйвери ,працює як часики.Для прогулянок по просторам інтернету,перегляду відео,легких іграшок більш ніж достатньо.Хто буде ставити windows 8.1 або 10 в комплектацію входять диски з драйверами для цих операційок,правда треба буде скопіювати їх на флешку . #мояраспаковка","компактний ,шустрий",трошки шумний кулер блока живлення,5
Доставили за пару дней Все отлично,Все работает Быстрая доставка,Нет,5
отлично для офиса,для офиса самое оно,нет,5
"Для роботи в офісі та для навчання, ціна - якість оптимальні",Для роботи в офісі це саме те що потрібно,поки незнайшов,5
"прийшов комп'ютер, корпус не відповідає зображенню, але перелік характеристик вірний. в комплекті був диск з драйверами, але як встановити драйвера з диску, коли відсутній CD-ROM? я не зміг знайти CD ROM корпус QUBE QB06M. він взагалі є? на корпусі пломба, яка не дозволяє лізти всередину, щоб не втратити ліцензії. правда в паспорті комп'ютера вказано що має бути заповнено гарантійний талон, щоб гарантія була дійсна, але він чомусь пустий зі сторони продавця... може я чогось не розумію?","ціна, габарити",встановлення драйверів,5
Всё хорошо.,Работает хорошо и быстро всё открывает.,Нет.,5
Он подойдьот для графики,,,5
Нормальный офисный вариант,за свою цену вполне нормальный комп. радует наличие hdmi выхода на видеокарте. дает возможность подключить одновременно и монитор и телевизор.,шумный блок питания,4
Не можу ніде знайти драйвера до мережевої карти для Windows 7. Що робити?,,,4
"играть на нем не собираюсь, поэтому производительность меня устраивает, надежность проверит время",шустренький для своих параметров,,4
не вірне фото товару і габарити.,не має.,великий корпус.,2
,,,5
Пришло быстро. Как связаться для возврата.,,"Не запускается, зависает на заставке!!!",1
"не первый наш комп Artline Business, отлично себе зарекомендовали, качество норм, поддержка норм,цена норм, по чучуть обновляем парк машин в офисе, советую #мояраспаковка","легкий, мелкий",пока нет,5
"Сегодня все установили. Работает отлично, просто летает. Ребенок закачал игры, не лагает). Хороший комп. Спасибо Розетке.","Цена, быстро работает.",Нет,5
Все дуже чудово працює тихо сучасні ігри тягне але на мінімальних налаштуваннях без відеокарти нарікань не мае все супер згодом перевірю краще коли поставлю відеокарти.,Сподобалося все і доставка і якість товару.,Поки що не мае,5
Неплохой бюджетный ПК в компактном корпусе. На это железо можно успешно поставить Win7.,цена-качество,для офисной работы,5
"Интересно, что внешне он выглядит как модель Artline Business а не как на этих фото.",Дешевые клавиатура и мышка в подарок :),Не могу сказать,4
,,,3
"Все работает отлично. Есть вопрос по поводу DVD привода? очень медленно считывает CD и DVD диски ели пользоваться различными приложениями . ""Раскручивается"" только при копировании с диска на хард. Подскажите как решить проблему?",,,3
не подскажите какой блок питания и видео карта подайдет,,,3
Нужно ставить хорошую видяху,,,5
"Данную видеокарту эта сборка потянет Gigabyte PCI-Ex GeForce GTX 1650 OC 4GB GDDR5 (128bit) (1710/8002) (2 x HDMI, DisplayPort) (GV-N1650OC-4GD) Подробнее: https://hard.rozetka.com.ua/gigabyte_gv_n1650oc_4gd/p84762492/",,,5
"Здравствуйте, станет сюда видяха Sapphire Pci-Ex Radeon Rx 470 Nitro (11256-10-20G) Подробнее: https://hard.rozetka.com.ua/77141898/p77141898/",I3-8100,Блок 400 w,5
"Вопрос представителю. Кокой формфактор материнской карты ? И какую видеокарту можно поставить в данный системный блок, низкопрофильную или обычная тоже зайдет ?",,,5
Потянет ли без замены БП видеокарту RX570 ? https://hard.rozetka.com.ua/sapphire_11266_66_20g/p83424906/?utm_source=recreativ&utm_campaign=teaser_202404734&utm_content=2391995&utm_term=desktop_80679&utm_medium=cpc,,,4
"За свои деньги норм комп, брал для родителей. world of tanks на средних настройках пошли без лагов. Ютуб - немного думает ...","Легкий,шустрый,ссд диск, 8гб озу",пока не нашел,5
"Месяц назад купил этот компьютер. Вентилятор на процесоре в новом компьютере уже торохтит? А так всё работает шустро, игры ище не пробывал",Быстрый,Вентилятор на процесоре уже торохтит.,4
Комп бомба сыну понравился.,"Тихий, производитеный.",Пока нет.,5
"Покупала сыну - всем доволен, компьютер шустрый, игры запускаются без проблем. Из недостатков могу отметить сильный запах пластика в первый день работы (сейчас вроде почти исчез). Ну, и для эстетов:) - подсветка на корпусе в розово-голубых тонах, а внутри, на материнка - ярко-красная, мне лично такое несоответствие цветов прямо глаз режеит:)",,,5
Коли зроблено цей ПК,,,5
Оплата при получении?,,,5
Какие игры он потянет на ультрах?,Не купил(,Не купил(,4
А вин тяне кс го?,-,-,4
В этом компьютере звуковая карта потдерживает формат акустики 5.1,,,5
А VR игры потянет?,,,4
"только получил и распечатал коробку;просто включил питание. Во первых-очень тихие кулеры. Во вторых-яркая подсветка , производитель не указал, что она полностью регулируется выкл/авто/яркость с пульта(поставляется в комплекте)это не малый плюс.После загрузки ОС и тестирования о отпишу",+++,"На данном блоке не увидел пломб, вынес мозг курьеру) В техподдержке Артлайна ответили оперативно-они внутренние",5
"Системный блок соответствует характеристикам на сайте, тихий с яркой подсветкой. Загрузка Windows 10 в течении 20 секунд, выключение - в течении 10 секунд. Все настройки графики на максимуме, лагов не обнаружено. Тем, у кого монитор с кабелем VGA заранее стоит позаботиться о приобретении переходника на DVI или HDMI. Спасибо Розетке, всё оперативно и чётко! Приобретением очень доволен!","Сверхшустрый, всё на максимальных настройках!","Нет в комплекте переходника DVI - VGA, драйвера на дисках.",5
"СПАСИБО, ARTLINE! Отличный ПК, всё Летает -)","Быстрый, тихий, красивая подсветка, не греется",Нет,5
"Спасибо за Ваш труд! Все чётко и быстро. Машина тихая, шустрая, подсветка красивая, не раздражающая. А вот теперь самое интересное: в описании на сайте указана карточка 1060, по факту получил приятный сюрприз от Артлайн в виде 1660! Огромное спасибо и магазину, и Артлайн!","Тихий, быстрый, компактный, красивый.",Не замечено.,5
Задоволенний на всі 100%,Висока швидкість в іграх та роботі,На даний час немає,5
"Комп огонь, тарков с настройками от dobi идёт 60+ fps",Карта gtx 1660 6g evo,",нет",5
Бистро прийшов і все чудово працює. Дякую за харошу роботу,Отлічний за свої гроші,Не виявив,5
Artline в мене є питання а цей корпус що на картинці коли він прийде мені імено такий?,,,5
,,,5
"Комп просто огонь,!!!",Докинули видяху 1660 6g evo,Нет,5
"Кто знает, как в этом корпусе регулировать скорость вращения передних куллеров??? Не могу найти эту функцию? И нормальная ли температура видеокарты 73градуса в игре Metro",Относительно мощный,не выявил,5
вдруг сломается надо везти в сервисный центер где его собирали,отлично работает,"нельзя самом поставить видео карту, стоять пломбы на гарантию",5
"Вообще классный, пришёл в отличном состоянии, советую всем",,,5
От какой фирмы оперативная память?,,,5
"а смогу ли я стримить ксго, гта 5, пабг, и eсть юизби VGA для монитора",,,5
"Установил Windows 10, проблем не было. Дрова десятка подтянула сама и все работает. Проработал две недели - всем довольны. Планирую покупать в дальнейшем.",Цена,Нет,5
,Все - ок,,5
"Хочу купить, Подскажите виндовс ставят в сервисе за дополнительную стоимость или можно самому ?",,,5
Для роботи норма,,,5
